ind,userName,content,rating,date,reviewVersion,compound,sentiment ,Unnamed: 0,sentiment
2,Hélèna Saoudi-Reviron,We should be able to give money back even if the parking is finished,4,2021-08-25,15.25.0,0.0,,2,neutral
16,ktia Brn,"It is a shame for the same vehicle, the same account, the same address, the same email, the same credit card to pay not to receive the same information concerning parking. My husband paid for parking from his cell phone and I paid for mine for the same period because the parking for the same vehicle located in the same place he had paid for was not listed on my cell phone! It would be wise for a census of parking lots by vehicle to be possible ...",1,2021-08-16,15.25.0,0.3595,,16,neutral
20,Evelyne Lambert,"Super simple and intuitive app, great for managing paid parking, no need to know how long you are staying, you can stop before, extend ... I would like to be able to use it in all cities.",5,2021-08-13,15.24.1,0.8316,,20,positive
24,Bruno Marro,"0.20ct. parking, 0.29 charge !! Will plan parts or change the system! Installed, uninstalled immediately!",1,2021-08-09,15.24.1,0.0,,24,neutral
31,Gilles Erard,It's good when you have no change !! Otherwise you have better time to put parts it's much cheaper! Costs of 27 cents in addition to the duration for 5 minutes is theft !! I will uninstall ...,1,2021-08-04,15.24.1,0.6973,,31,positive
35,Lucile Vezzoli,"I have been using this app for several years. It is necessary to check the parking zones on the city parking meters before paying for your parking through the app as there may be errors. Despite the verification of the geolocation, I paid for parking in the ""green zone"" in Bordeaux via the application which turned out to be, according to the plans of the city, a ""red zone"" which led me to have to pay a fine....",1,2021-07-29,15.24.1,-0.25,,35,neutral
44,Thierry Brunet,Convenient for paid are monthly or quarterly parking. They make alerts for you indicating the end of your parking. I recommend.,4,2021-07-19,15.24.0,0.3612,,44,neutral
47,Guy Pyrenebordeaux,I would have liked that we could program the start of the parking lot,4,2021-07-16,15.23.0,0.4215,,47,neutral
66,Sebastien Texier,"Since the last update, I no longer have my parking rights in Bordeaux. I can no longer buy a subscription, change vehicle, or pass 52 ... practical. And impossible to synchronize with the site, well done",1,2021-06-26,15.23.0,-0.3182,,66,neutral
70,Marie Thérèse Wininger,The facility no longer need to look for change !!,5,2021-06-14,15.22.0,-0.4184,,70,neutral
75,Sylvie Sissau,"It's great I recommend easy to use, there is no need to look for parking meter and it's fast.",5,2021-06-08,15.22.0,0.8074,,75,positive
86,Thierry ANTONY,That happiness no need to look for change and keep you informed of the remaining time,5,2021-05-27,15.21.0,0.34,,86,neutral
92,Laurent FELIN,"Well, I wouldn't say that I take pleasure in paying for my parking, but it is true that this application is well designed. This allows you to walk with a light mind and to be able to extend your parking distance if necessary. Nevertheless I would not put 5 stars because the invoicing of the sending of a proof by email or then of an SMS alert, it is still a little abused. In addition, it necessarily works only in places where there is a data network.",3,2021-05-13,15.20.0,0.8438,,92,positive
104,Antonin Rey,"I made a request for parking assistance to the city of Bordeaux which was accepted, but it was impossible to make the link with the application which gives me the visitor rates and not the resident rates. And really I do not understand how to indicate to the application that I am entitled to the resident rates ... Suddenly I pay via the site and not via the application ... Too bad",2,2021-04-19,15.19.0,-0.4854,,104,neutral
106,Amelia Barros,"Excellent esay Park terminals! No need to take out all kinds of parts, or just enter your car number, Everything and into the phone. Plus, at the end of the month, I can print (from my phone) the invoice for my monthly expenses to give to my employer! It suits me 100%",5,2021-04-15,15.19.0,0.5242,,106,positive
107,Léa MORTIER,"Very practical application only I remove a star because there is I think a bug that must be paid attention to. When you want to extend your parking time, wait until it is over to resume one. Otherwise the app charges too much. Example: I had planned until 5:30 p.m., I wanted to anticipate and extend it until 7 p.m., I go up to 30 € (for 4 hours of parking in all). Surprised by the price I waited 5:30 p.m. (so the end) to start over and there, € 2.70 until 7 p.m.",4,2021-04-15,15.19.0,0.3612,,107,neutral
109,Morgan Klein,"I told myself that I was going to test. 1) I had to enter my credit card number from the start. As well as my tel number. 2) I can't find any parking around my home, neither in Paris, nor in Nantes. 3) I find it bad, I uninstall. 4) I told myself that I would have to delete my account to leave my personal data lying around, especially with the databreaches that we often hear about. 5) I type the name EasyPark on google and I come across the site of nacy, strasbourg, belgium, australia, but nothing to delete his account 6) I reinstall the app, and I find in the FAQ that to delete his account must call a 09 ... Really bad!",1,2021-04-11,15.19.0,-0.8117,,109,negative
110,Laura Bgl,"I would like to delete the data of my bank card but impossible ... PS: I am modifying the note, for a quick response from customer service",5,2021-03-26,15.18.0,0.1901,,110,neutral
120,glandchef,"Everything is done so that we get tricked into this application and that we have trouble renewing our parking lot or subscription and if we want to be warned of the imminent renewal, we must pay! No possibility of automatic monthly subscription and the app will take care not to remind you",1,2021-03-01,15.9,-0.5848,,120,negative
140,Trail la Fumana 10km Nancy,"Notice updated following an article in the Republican East: it is the most expensive application on Nancy! Another scam! if you forgot to pay and you do this remotely and in the meantime you have a PV (and even if you come back to the car to check if you have PV, it is still necessary that the person must not forget to put the info on your windshield) and well too bad for you: no recourse possible .... I have no choice to use this application",1,2021-01-05,15.14.1,-0.8695,,140,negative
149,Ludovit Martonyik,"Wow. After paying for my 2 parking lots today, I learned by SMS that I have the ""Standard"" offer which costs 0.29 € more for each parking lot. Of course, you have to deactivate it if I don't want it. I never wanted this standard offer, nor paid for unnecessary additional service. You're welcome for the 2x 0.29 €, I hope it's worth disappointing people for additional turnover! (and thank you for giving me the opportunity to give my first negative review on an app: D)",1,2020-12-16,15.14.1,0.8878,,149,positive
152,Un utilisateur de Google,I do not recommend it for residential subscriptions. They do not count the holidays on subscription. You pay extra days.,1,2020-12-03,15.14.1,-0.571,,152,negative
153,Najoua ABARKI,It would be very convenient to indicate the amount of parking in the history list. This would avoid clicking on each parking lot to have this information knowing that returning to the list systematically puts us at the top of the page (if we had scrolled),4,2020-11-30,15.13.1,-0.1027,,153,neutral
155,Vincent Payrat,"in Brussels I used this application for a few days, and I have already received 2 parking tickets for 3 days of parking, while the people in charge of the application tell me that everything is in order. After 2 months of pressure I was able to be reimbursed for the two PVs. The application is very good and practical, but please make sure that the local services follow the digital transition, otherwise the obstacle course to be reimbursed for their mistakes will nullify its benefits.",4,2020-11-29,15.13.1,0.51,,155,positive
160,V DJ,Very safe ... frankly I am very happy with this application. He quickly finds the location on the map and you can only pay for the actual parking time.,5,2020-11-03,15.12.3,0.7774,,160,positive
161,FM 3331,"Awesome ! This application is really super efficient, it avoids having to find the parking meter and possibly waiting in line. You can also add more time if you need it or stop the time as soon as you have finished. We only pay for what we consume. I highly recommend !",5,2020-10-31,15.12.3,0.909,,161,positive
172,I Andria,I change my note. Following an update I could no longer add my credit card finally I went through Paypal. The application is especially useful when you have no change with you and avoid running to put money back in the parking meter. 😅,5,2020-10-12,15.12.3,0.4005,,172,neutral
177,Ingrid Demaison,"Great, no need for change!",5,2020-09-23,15.11.1,0.4926,,177,neutral
179,Antoinette Vroom,Cannot change plate / add new car. Annoying when renting a car!,1,2020-09-18,15.11.1,-0.4574,,179,neutral
188,Noémie Létrillard,Scam! Take 30 € for 1 hour of parking I do not recommend!,1,2020-09-05,15.11.1,-0.7502,,188,negative
192,Braunbarth Odette,It is a good innovation to pay for real parking ... except for those dizzy who forget to stop it if they leave early compared to the scheduled time! It should stop automatically when the car leaves the location 😊,5,2020-08-25,15.10,0.6114,,192,positive
196,Karine G.,"Super practical and super easy to use. So far I haven't encountered any bugs, no problems. So nickel. I find it great to be able to manage my resident parking lot but also to be able to enter a second vehicle for a one-off parking (that of my mother in this case, who no longer needs to have change when she comes to visit me). 👍👍👍",5,2020-08-15,15.10,0.7375,,196,positive
200,Grégory,Top. No more worries about small change. Very intuitive app,5,2020-08-07,15.10,0.3016,,200,neutral
211,Marc F.,No need for change. We pay to the nearest cent. Very practical and very economical. Tested in France and Belgium. Great,5,2020-07-17,15.9,0.3612,,211,neutral
212,Rad Ouane,i am mad at this app a real scam. sloppy money trap application. 30euros for 2:22 on July 15 and the icing on the cake a PV that I paid in addition to 15euros to their agency in Metz. nobody listened to have little to go back. I also address to the town hall of Metz 2:22 for a sum of 30euros c is abut du Vol even in Paris have not paid for that. afterwards do not cry if the trade closes in the city center of Metz. do not even know where to go !!,1,2020-07-15,15.9,-0.8036,,212,negative
215,Corinne Bouchet,Very practical and easy to use! Save time I highly recommend! 😊,5,2020-07-07,15.8,0.9434,,215,positive
218,Jean Gaëtan Tardino,Excellent and indispensable. Modular at will. We only pay for the time spent in the parking space.,5,2020-06-27,15.8,0.5106,,218,positive
225,Carmen Boulanger,"I pay for what I consume and it suits me perfectly. No need for change. On the other hand, watch out for the uncharged phone.",5,2020-06-06,15.7,0.7003,,225,positive
226,Damien Faisandier,"Hello, the application was working fine two months ago but an update has changed this: the application no longer gives any end of parking warning !!! So I asked that the application send an SMS to let me know when parking is over if I was not notified by the application. I receive a parking start sms! No use. In short, quickly dive into the problem because it is very very annoying!",2,2020-06-03,15.7,-0.9547,,226,negative
228,Loïc Lachiver,"Very practical, I lost a maximum of money without any worries since the deconfinement, having no other choice but to keep my car in Bordeaux. Thank you and long live France",1,2020-05-20,15.5.1,0.3683,,228,neutral
231,Véronique Tinniere,Good application. Easy to use. Much simpler than parking meters. I recommend.,4,2020-05-06,15.5.1,0.8074,,231,positive
232,Thierry Journet,"Very good, but the success of the application would depend above all on it being universal or in any case bcp more usable in bcp more cities. I know it's complicated but this is the top that I have to work on I think. Otherwise very good.",4,2020-04-30,15.5.1,0.9279,,232,positive
246,Marie LEB,"I have been using this application for a year and I find it very practical. No more worrying about how many rooms to put in depending on how long I think I will stay. So not very well. Two caveats: the pricing is not clear at all (no indicative grid) and then my phone has not been able to charge it for 24 hours. I suddenly uninstalled it and reinstalled it three times, nothing to do. Too bad .",4,2020-03-05,15.1,-0.798,,246,negative
247,Géraldine Trabut,Ideal for parking in Bordeaux without worrying about having enough change,5,2020-03-04,15.0,0.6636,,247,positive
249,Sylvie Courant,Very convenient. Modular. No more need for change!,5,2020-02-27,15.0,-0.4129,,249,neutral
256,Edwige Ponsard,Super practical !!! No need to go to the parking meter or look for change.,5,2020-02-19,15.0,0.5538,,256,positive
266,Laurent,"An unclear interface on the display of prices, it would be useful to put it in a clear and visible way, not in the same tones as the wallpaper. Result: € 30 for 2h40 of parking in Metz, not in Dubai. The Customer Service can do nothing, neither the town hall, nor indigo which has the delegation of parking service. THANKS EASYPARK, the app is very easy to use to pay. A bad experience.",1,2020-02-03,14.9.1,0.7526,,266,positive
267,Sebele Catherine,No need to worry about having change with you. You can stop parking very quickly and easily if you leave the parking lot before the scheduled time. Ditto if it is necessary to extend the parking lot. Real comfort. Loading the app is very easy. No need to be a geek !!,5,2020-02-03,14.9,-0.3195,,267,neutral
269,Mélanie Deitsch,"Shameful, a craftsman does not have the right to put himself in the status of craftsman, visitor obligation, pay full price for his half-day parking in Metz! Parking is currently prohibited in front of customers' entrances ... As if the break equipment discharges itself from miles away and that it is as light as a feather. We have no choice but to take a taxi to avoid the cost of parking. (The craftsman's daughter) Impossible to extend her parking to more than 3-4 hours, shameful!",1,2020-02-03,14.9.1,-0.8602,,269,negative
276,10H Video,good application. Too bad there are some bugs like the help page that doesn't work. Some very interesting ideas: - Android auto. This will greatly facilitate its use. - Ability to send suggestions.,3,2020-01-29,14.9.1,0.8357,,276,positive
286,Michel WINGERTER,"It is very practical! Pay per minute, no need for change, possibility to remotely modify the preset parking time.",5,2020-01-12,14.8,-0.4889,,286,neutral
291,Bastman,"Unable to pay for the subscription from the application, having to go to the website for several months. This problem follows an update and is very common among users ... If you had employees as ""reactive"" behind this application as they are in the street to give us a hard time that would be the best .. .",1,2020-01-07,14.6.1,0.0708,,291,neutral
294,GUY JURADO,I installed the application unable to connect with my number the application has become unusable I hope that the city of Reims will change the application,1,2020-01-07,14.6.1,0.4939,,294,neutral
295,Stephane Bonnell,"Tested for its function: to pay for parking. Very practical in 2 clicks it's done. Some flaws: the app moans about my expired credit card when it has a month left. Unable to display help, the page appears and then returns to the app. And if not 0.15 € to receive a receipt by email in pdf (therefore costs nothing once your system is in place), it is not a little abused! Not very clear if I will also pay when I ask for a receipt each time.",3,2020-01-07,14.6.1,0.5067,,295,positive
296,Joëlle mansuy,"Great this application, easy, fast and very practical. The price is based on the actual time spent on site. I recommend.",5,2020-01-07,14.6.1,0.8591,,296,positive
299,Léa,Top top! It's up to you to choose your parking time and change it at any time. Allows you to pay the bare minimum in 1 click and remotely.,5,2020-01-04,14.6.1,0.3595,,299,neutral
303,ooo ooo,"Impossible to add PayPal account. There is another operator in the city I regularly park in, but it doesn't propose PayPal as a payment method and Easypark seems to be usable across Europe. As is I can't use the service. It seems a recent update caused havoc. Please fix or rollback to a functional version (or hire more testers). Regards",3,2020-01-03,14.6.1,-0.5267,,303,negative
310,Liliane Dietschy,Very good invention very practical no need for change. Perfect. Thank you. I recommend it to everyone,5,2019-12-21,14.6.1,0.8561,,310,positive
313,Bastien Dugas,"Like a lot of other users, Neither PayPal, nor adding a bank card possible ... Easy that means easy, right?",1,2019-12-19,14.6.1,0.8074,,313,positive
318,Jean Paul Anselin,"Apart from the great difficulties in reaching your platform, a competent, available, charming contact person (Chloé) will work hard to solve your problem and follow the file until it is resolved: bravo for this support.",4,2019-12-13,14.6,0.9067,,318,positive
326,Christian Deveza,very practical application. control of parking time to the minute and remotely. real savings achieved. .I recommend !,5,2019-11-29,14.5.1,0.4199,,326,neutral
329,Vincent Limorté,"Forced by Bordeaux to use this private provider for resident parking: anti-ergonomic app as possible. Constant request for localizations, 5 menus to get my subscription for the day, impossible to program the start time ... It was already not terrible before, but the last update made it worse. Thank you bordeaux :(",1,2019-11-22,14.3,-0.7161,,329,negative
330,JACQUEMINOT Nicolas,"On the principle OK, but faced with two fines in quick succession I check the history and surprise the payments o't disappeared! I check my bank account and yes the amounts are debited! I explain everything on a recourse which of course is refused to me! Two fines and parking lots debited! So no 'I do not recommend! To flee !",1,2019-11-22,14.4.1,-0.6578,,330,negative
339,J Jara,"Unfortunately the use of this application cost me 30 euros of parking + 30 euros of almond. Easy Park does not allow you to anticipate the time restrictions specific to certain areas. You can pay the maximum parking time without any constraint or warning. Although the customer service was responsive, unfortunately they could not provide a solution. I have not been reimbursed for any overpayment. I do not recommend.",1,2019-11-14,14.3,-0.5911,,339,negative
340,Nicole Duroyon,Too good not to worry about going to the parking lot and having to give change,5,2019-11-14,14.4.1,0.6492,,340,positive
343,Guillaume de DURAT,Help systematically crashes It would be good if we could enter a free parking car (disabled card),3,2019-11-10,14.4.1,0.836,,343,positive
344,jennifer donze,I download it to make my life easier and in the end I never receive my new password by sms when I ask for it .... donx app block. And unable to register my Paypal account. Sure ! Nice app for simplicity. I didn't bother trying it anymore than if I had done nothing! To review. Good idea but bad implementation,2,2019-11-09,14.3,-0.6148,,344,negative
348,Valentia Sparrow,"Hello, This section may not be suitable but I would like to share a concern encountered today. I find the application very practical, on the other hand I do not have the impression that its functioning is optimal. This morning I wanted to park for a long time, which the application seems to accept, but I ended up receiving a receipt two hours earlier than expected! Why aren't we warned that we can't plan to stay parked from 9 a.m. to 5 p.m.?",3,2019-10-22,14.2,0.9553,,348,positive
353,Mélie MORIN,"I use it in Laval and it tells me every day that my account is inactive, I have to put another card and then put mine back every day and I find that unacceptable. No change at this level. When is someone going to do something? BETTER AND BETTER. I was advised to uninstall and reinstall, and today I can't even connect !!!",1,2019-10-07,14.1.1,0.6049,,353,positive
361,Frederic page,"Lousy and dangerous: in Reims, the first 15 minutes are free, but it is impossible to spend more time when starting up. Result: if you do not think in time, it is the PV assured.",1,2019-09-14,13.9,0.2732,,361,neutral
362,Louis,"A horror .. Bug on bug, do not count on it and plan for change",1,2019-09-13,14.0,-0.5719,,362,negative
363,sylvie dubois,No more looking for change,5,2019-09-09,13.9,-0.296,,363,neutral
369,Samuel Nussbaumer,"We pay by the minute. And unused minutes are not billed. If you are late for an appointment, you can change without having to travel with your smartphone.",5,2019-08-29,13.8,-0.1027,,369,neutral
371,Olivia LEFORESTIER,Very practical as soon as there is no change,4,2019-08-28,13.9,-0.296,,371,neutral
373,Rom F,"Since the 4/8 update the application no longer works at all. Message ""EasyPark has stopped"" each time you try to access ... You tell me that Android must be up to date. Yes, my laptop has the most up-to-date version possible, but not everyone has the means to change their smartphone every year. Until then, all of my other apps are working except yours. Too bad, so I now have to switch to OPnGO.",1,2019-08-15,13.7.1,-0.714,,373,negative
385,Chantal Jacqmin,Unfortunately the new version no longer works on my galaxy i905! and the sav offers me to change my smartphone! disastrous,1,2019-07-24,13.6.1,-0.8436,,385,negative
386,Céline Perez,Very easy to use and very practical I recommend,5,2019-07-23,13.5.1,0.7146,,386,positive
388,christophe riba,No longer used: my subscription and my rights are no longer synchronized with my account. No improvement following the update contrary to what the customer service had told me. I uninstall and will now go through the mobile site. oneplus 3t / android 9,1,2019-07-18,13.6.1,-0.7077,,388,negative
392,Carron Sébastien,"very practical, I recommend.",5,2019-07-10,13.5.2,0.4144,,392,neutral
402,Florine Miclo,"hello my app is blocked today, would it be possible to help me please?",1,2019-07-01,13.4.1,0.4404,,402,neutral
404,Na H,application not always very fluid ... it would be good to have prices or loyalty reductions,4,2019-06-28,13.4.1,0.7506,,404,positive
408,Ilse Moreira,"Practice ! No more worrying about having change. Apart from some bugs encountered 2 or 3 times and due to computer problems, I highly recommend the installation of this application.",4,2019-06-26,13.4.1,0.1316,,408,neutral
412,Alexandra PANSERI,"Why does the application no longer display correctly since the update ??? Too bad, I will be there very regularly but I can no longer choose the duration of the parking. Need help please. Thank you very much for your responsiveness Too bad Android does not follow up, can't wait for the app to work properly Long live Easy Park !!",5,2019-06-24,13.4.1,0.6513,,412,positive
418,Evelyne,"With this system, no need to carry change and you only pay for what you consume in time. I find this application really great and I recommend it to those around me",5,2019-06-19,13.4,0.6478,,418,positive
424,Anthony Berrial,"I used it once for parking at a specialist appointment, not knowing the duration of the consultation, the application is really practical, the fact of extending your parking time remotely with a reminder before the parking deadline is really great, I will use it again!",5,2019-06-13,13.3.1,0.6893,,424,positive
432,Stéphanie PRISSET,very practical I recommend easy to use.,4,2019-06-05,13.2,0.6872,,432,positive
433,Lore Humel,"I believe this will be the first and last time I use this app. In fact, it is very practical but the incomprehensible payment problems make me regret its use. While waiting for a response from customer service ... What a pain ...",1,2019-06-05,13.3,-0.9136,,433,negative
442,Eric Moreau,"The app itself works well. But pay 100% more than the normal price paid at the parking meter blah blah After the developer's response I tested, and his response is not correct. I was parked for 1h14, charged € 1.58 per app. If I had taken a ticket at the parking meter, I would have paid € 1 for 1h20. 60% more then. Pay a little more for the service ok, but 60% no thanks",1,2019-05-25,13.2,-0.8213,,442,negative
446,Nina Nico,great I recommend and especially practical no need to go get a ticket,5,2019-05-20,13.2,0.6275,,446,positive
452,Gregory Jouanne,"very disappointed. for monthly subscriptions, they send a notification 1 week before the end of the subscription. Suddenly, we can forget the day or restart the subscription and take a PV equivalent to double the monthly subscription. A notification on the last day would be much more honest.",1,2019-04-29,13.0,-0.1779,,452,neutral
461,Martin Marx,"It has been impossible for several days to use the resident rate (my resident rights are valid until 2020). The app gives me an error 11338. I'll change my rating when this problem is fixed, as the rest of the app is pretty well thought out and practical.",2,2019-04-10,12.7,-0.1343,,461,neutral
465,celine tribout,super practical me who never has change and reliable system.,4,2019-04-08,12.7,0.5994,,465,positive
