ind,userName,content,rating,date,reviewVersion,compound,sentiment ,Unnamed: 0,sentiment
3052,PärN,"The SMS Park app had all the features needed while the Easypark app has - well, nothing in comparison.Neither the price nor - more importantly - how long you can stand is shown on the map in the app, which makes it impossible to plan your parking in advance.But the ""Show information"" button is pink and nice in any case ...",1,2021-05-19,15.21.0,0.4061,,3052,neutral
3055,Ebba Svensson,"May be the laziest app I've been to. It seems that it is too heavy and it is very tough and slow to press buttons, for example it is not possible to set reminders the app does not give a response when you try to press there. Due to the viscous app, I did not manage to pay my parking fee and got a parking ticket, not so much fun.",1,2021-04-27,15.20.1,-0.7967,,3055,negative
3056,- - M - -,The only thing that is bad is that you can only park 1 car. It would have been good if you could pay for several cars at the same time,4,2021-03-22,15.18.1,-0.25,,3056,neutral
3058,RedBeardRichard,"The app ended my parking after a minute without notice. Fine: 900. Customer service: ""You have unlocked your phone and physically clicked on stop. It is the only way to stop an ongoing parking."" I had the phone locked in its case, in my inner pocket and the only way to unlock it is with face recognition. I did not touch it after I started parking for several hours. A method of payment that does not guarantee that I will not receive a fine is completely indefensible. Anything is better.",1,2021-04-26,15.20.1,-0.5305,,3058,negative
3060,Dren96Gashi,"UX is down to the ground, especially the way around the map",1,2021-04-25,15.20.1,0.0,,3060,neutral
3061,svårparkerad,"The search function is impossible to use in many places. On many plastics, the app does not find that I am standing in a parking lot and it is not possible to decide that I am parked in place 1234 because then the app decides that I am in the US.",1,2021-04-21,15.20.0,0.0,,3061,neutral
3062,😃😄👌🏻😅💪🏻,"Nice app! On the other hand, I miss being able to park two cars at the same time as you could in SMS park (which is now being phased out). Is in need of this so I hope there will be support for it in the next update./ Johannes",3,2021-04-20,15.19.0,0.8903,,3062,positive
3066,Connyrocker,Used this app before but never again .. has lots of extra charges others do not have. Completely useless when you move around in different places in Stockholm .. bye bye easypark! Greed is useless .. why would it be more expensive to park in eg Väsby compared to Solna .. because you are not in that zone .: ridiculous. Check out their competitors they have no fee. And it does not matter if you are going to park in the inner city or Solna or Väsby for example .. easypark charges extra in the different zones,1,2021-04-06,15.19.0,-0.9401,,3066,negative
3068,Mejann,Have happened to turn off the parking several times when I have to swipe up to change the app. Really bad UX.,1,2021-03-27,15.18.1,-0.5849,,3068,negative
3070,flamencokungen,"Since the first of March, I get a service fee of SEK 4.95 for each time I park in a certain place. I've been there before without getting this service charge.But according to customer service, it's because I parked in a two-hour free car park elsewhere (yellow zone?) In our city, and then did not change ""operator"", and this is apparently done in the app. But it is not possible to change ""operator"" in the app. There is only one (Swedish parking service, or something) that comes up when I try to park in the first mentioned place. I usually shop at ICA, but if I go to Coop and buy milk, ICA would, according to Easypark's logic, raise the milk price for me in the ICA stores ..?The terms and conditions state that you must be notified a certain number of days before prices change. I think this is a price change, and I have not been notified of it. On a couple of occasions when I parked in the first-mentioned place, a warning box ""It was not possible to park"" has appeared, but when I clicked on it, the parking started. Is that Easypark's way of saying that we'll put a five on your parking lots from now on. A little unclear in that case.No thanks, no more EasyPark for me.",1,2021-03-24,15.18.1,0.4677,,3070,neutral
3073,Obba Karlsson,"Got home a paper invoice + SEK 25Went in and would change to card payment, does not go due to error, the next day the same thing and today the same thing. Hmm? Have a parking that is unpaid therefore it is not possible, so there will be a paper invoice for the parking I did this month with hahah will never use your service again",1,2021-03-18,15.17.1,-0.4019,,3073,neutral
3078,Fam Agucci,Easy to manage app and smooth map 👌🏾,5,2021-03-05,15.17.1,0.8415,,3078,positive
3082,Jokeroo96,There is no better way to pay for parking than EasyPark !!! Easy and use nice design !! Reminds when the time in the parking lot ends so you can extend the parking if needed !! So the BEST app !!!!,5,2021-03-01,15.17.1,0.905,,3082,positive
3083,Dannis ✧˖,Great app! Have also pointed this out earlier but can not map be redone so it is dark in Dark mode as well? Think it gets so dazzled in the dark ..Apple Maps (speaking of maps) is adapted for both light and dark. A widget feature to extend / shorten ongoing parking would have been handy too!,3,2021-03-01,15.17.1,0.7804,,3083,positive
3087,cygglo,Unreliable function! Park and check that the map pin is in the right place. Pays but receives a fine because it is the wrong area code. The tariff would have been the same and the same parking company!Extremely bad !!Contacted EasyPark and they do not think it is their responsibility that I have to pay SEK 900 in fines because their technology did not work./ Magnus,1,2021-02-26,15.17.1,-0.8877,,3087,negative
3088,cammylinnea,I think it is difficult to set where you stand with the car. The area code can never be entered (it cannot be found). And the parking lot I'm in is not always on the map ... very bad.,1,2021-02-23,15.17.0,-0.7425,,3088,negative
3089,kakakskakskdlsks,"In some parking lots, the map function does not work and when there is no reference to the area code, the user is fined for incorrect parking. Extremely unworthy because the parking companies that the user then has to argue for have no business interest in making the service better or trying to understand the situation.",1,2021-02-19,15.17.0,-0.8259,,3089,negative
3090,DeveloperX,"Ok, so the municipality is changing service provider from Parkster to Easy Park. Fine, whatever ... installs the app, puts in the car and will renew the housing ticket for another six months. First of all, I was not allowed to choose the payment method when buying, but it took the card associated with my Apple Wallet straight off, even if I would like to use another card, strangely required and implemented - you should inform the customer early in the purchase phase where the money is withdrawn and give the opportunity to add cards, as it is implemented now you get a big ""meh!"" from me as a system architect and developer. Another thing is that I expected Easy Park to match Parkster's functionality (if the municipality did a good job in procurement), unfortunately it turned out that Easy Park has no function to choose the date when my housing ticket will take effect but assumes that I want DateTime.Now () so now I lose one day and SEK 70 in value, fun - thanks for that!",2,2021-02-14,15.16.0,0.9737,,3090,positive
3092,Matte1912,"Unable to trust the app! Even if you enter the code that is on the post, it is not certain that you will get a valid parking. Europark seems to have taken over the parking areas but not removed the EasyPark sign, and can then set a fee of 900: - Since you can not be sure what applies, the app is VALUABLE!",1,2021-02-14,15.16.0,0.7297,,3092,positive
3095,scottie56789,Got a fine 2 times after the app turned off my parking myself. Called for help but got an answer that it was Telia and a service called Senes and Telia would pay my fine. No one take responsibility and I am just sent around even if I have done the right thing for myself. This app is a scam when easypark does not want mare for their product.,1,2021-02-08,15.16.0,-0.7456,,3095,negative
3098,Oscar Kjellberg,"Had to change from SMS Park to Easy Park. What a difference, SMS Park worked flawlessly, while this app incessantly hassles with various error messages. In addition, you charge a service fee of at least SEK 4.95 or 15% on parking (becomes interesting when you park where the first 3 hours are free, then it suddenly costs SEK 4.95), you charge a fee for a reminder SMS that the parking time is running out etc. Just lots of fees for miscellaneous, what is the next step, to charge for logging in to the app maybe? Scarce and hard-to-find information, the app refers to the website's home page instead of taking one to what you are looking for. Everything is designed to make it as difficult as possible for users so that Easy Park can charge as much as possible and write as many parking fines as possible. Very disappointed and will avoid these parking lots as much as possible. A joke to companies that hopefully will not last long in my municipality.",1,2021-02-04,15.16.0,0.7897,,3098,positive
3100,Hepsnastian,"Works well, often use this app. However, I think that it sometimes crashes when you open the app, then it does not find where you are, and you have to restart. Sometimes it does not even show ongoing parking ..Then you can ask yourself the question, how can the app draw 11% battery for a day when you do not even use it? Not even Facebook or any other app I have for that matter draws that much battery.",3,2021-01-22,15.15.0,0.296,,3100,neutral
3102,Tomatmosaren,"EasyPark is a fast way to pay for parking and the app has good features but it is not possible to park two cars all together. When I tried, however, I did not get an error message but thought that the payment had gone through and that everything was peace and joy. Real snoop when the sister's car got a cure and not mine. Hope you can fix an error message when parking does not go through, it will be five stars from me best time.",3,2021-01-11,15.14.1,0.9406,,3102,positive
3110,ihatetoregister,Has gotten better when you are not offended by the messages and the app. But would be nice with some smoother payment methods such as Swish or Apple Pay.,3,2020-11-26,15.13,0.6619,,3110,positive
3122,Fifuner,"Stood and paid for parking for a whole day (a couple of hundred bucks) but comes back and has received a parking ticket. This is because I was parked at a time when parking was forbidden. It was absolutely my responsibility to keep track of it, but it would have been appreciated if such information could be found in the apps. Especially when this rule applies every week 6 months a year. So you do not have to throw out several hundred and then come out to an o-fine of SEK 1,100",3,2020-11-02,15.12.1,0.1901,,3122,neutral
3125,Obslösa,"EasyPark would transfer our footwear account automatically from SMS park.This has not been done and nothing has worked despite repeated calls to customer service.Each time, they promise to solve the problem, but then absolutely nothing happens!",1,2020-11-05,15.12.1,0.126,,3125,neutral
3135,Hallis77,I am super happy with EasyPark! It is easy to use with very few steps to get the parking started. Good upgrade with appealing design !!,5,2020-10-09,15.12.1,0.9357,,3135,positive
3138,segeltorp,"I have used it since the beginning. I think it is easy and pleasant to use. Paying only for time spent is also important. Also to see where there may be vacancies - in my case usually Stockholm. I have the payment linked to PayPal, which is smooth and accurate. Highly recommended.",5,2020-10-08,15.12.1,0.8439,,3138,positive
3140,Opteron-SE,You have to fix location in iOS. When opening the app and pressing the button should zoom in the location but it still shows the map over the whole world. I have allowed location and gps on my phone so it should not be a problem,1,2020-10-08,15.12.1,0.438,,3140,neutral
3141,Jstahle,"Had to use EasyPark when they bought SMS Park and they no longer work in all zones. Did not move over my payment information when the account was moved, can not be extended or parked for more than a day but you have to start a new one every day if you want to park in e.g. four days (plus a new service fee each time) and will not find codes even though you are standing next to the sign. Overall much worse functionality than SMS park. Hope it does not take too long before they integrate what was good with SMS. Last but not least, definitely more expensive than SMS park.",2,2020-10-08,15.12.1,0.7,,3141,positive
3158,Vik Marketing,"I had problems with push notifications, you have to go in and activate them yourself. I got it anyway. And then they do not work in the parking lot that is running. Started working for me then and then I think it is great. Maybe the only downside is that dne seems to check my position even though I do not have prkwring running? Is that true developers?",4,2020-08-25,15.10.0,0.5514,,3158,positive
3159,Niklas 2x2x4,"Each time you change programs, it deletes the entered speed dial number. Completely impossible to add funds. Part 22, can not be used without means of payment, but it is not possible to copy in card numbers, expiration, etc. Jesus, do you not try the app with copy and paste? No usel app!",1,2020-09-05,15.11.0,-0.4482,,3159,neutral
3160,The Brax,"In the SMS park app, you could park several cars at the same time. Misses this feature here as it poses problems when we each take a car and park at the same time. Know that you can create your own account, but it is not as easy if you e.g. changes car while parked.",1,2020-09-05,15.11.0,-0.5939,,3160,negative
3161,iPhone 6 går ej logga in,Scam companies that send out notices that do not arrive which then go to debt collection.so your parking that would cost SEK 30 will be SEK 1000 instead.,1,2020-08-28,15.11.0,-0.7351,,3161,negative
3168,Fitnäs,Has become extremely expensive compared to competition. Check the alternatives before start using this! Short term profit maximization means loss of customers in long term. Bye bye EasyPark,1,2020-08-17,15.10.0,0.2244,,3168,neutral
3171,MaxOrginal1990,"Even if you receive confirmation that you ""Bought"" a P ticket, the purchase ends automatically when you lock the phone which results in you getting a P fine because you do not have a ticket. This is under all criticism, then EasyPark will blame it on the user wrong and not get help with a Krona for P fine.",1,2020-08-10,15.10.0,-0.794,,3171,negative
3173,EpicJoey,"Sometimes the purchases are not registered, even though the application claims so. Since money is only withdrawn afterwards, it is impossible to confirm. I have been fined for this and would give this app 0 stars if possible. Contacted the support and they refused to help me.",1,2020-08-10,15.10.0,0.4939,,3173,neutral
3177,Ingela P-ingela,"Have never experienced that a parking app has been perceived as so complicated in its settings and conditions as this.Is it so that one actually wonders if they have a profit partnership with the parking company that issues the parking fee ?!For a ""complete"" version of the app, they inform that you are forced to pay a service fee, but they ""offer"" a free version for parking in Malmö. Of course you do not want to get that fee! The fact that it is then complicated with settings and that it is also difficult to interpret where you can park when you visit Malmö means that the risk of parking fees is super high. That the app does not tell you that you have made a mistake, but you are tricked into thinking that you have done as you should be tricking you into false security. No, choose another app! This is totally useless!",1,2020-08-03,15.10.0,-0.4099,,3177,neutral
3181,Behindteblue,"Gets error code over and over again ... terribly annoying !!!And not only when adding a car, but also with all other features .. good update? No would not say that ..",1,2020-07-30,15.10.0,-0.5894,,3181,negative
3185,nrella99,"Easypark develops Stockholm's pay p app which we all know is the most worldless app that has existed. To drive traffic to easypark's own app and get service fees, lousy. Will not use more.",1,2020-07-22,15.9,-0.5994,,3185,negative
3187,___Bjorn___,"I think it is unclear that you charge a fairly substantial fee for each parking space. Chose another app to pay with now for a 24-hour parking in Stockholm, which then became SEK 27 cheaper. SEK 27 fee for using your app is completely unreasonable. Plus I do not like companies that charge fees they do not clearly report. Recommends Parkster which does exactly the same thing but with no hidden fees. additional comment on answer: that it appears on the receipt after purchase is in my world a little late. Throughout the app, you do not manage to say that you have added a fee, even though there are many logical places to do it. That I would at one point pay SEK 27 to contribute to your app development is unreasonable. Try to take SEK 27 for the app in the App Store and see if anyone is willing to pay it even as a lump sum. Would be exciting to hear what you think I get for the money given that there are free alternatives on the market that do the same thing.",1,2020-07-17,15.9,0.4466,,3187,neutral
3189,Propellerhuvud,"First - a great app to park with! BUT! When the update on July 9, 2020 came, ALL information from the app was emptied. No payment connections, vehicles or parking history left !!!! How the hell did you think ??????? Do it again and do it right, because this is incredibly classy done on a good app that has been around for a long time, and makes all parking so much easier.",2,2020-07-15,15.9,0.7707,,3189,positive
3194,Banana Lipgloss,"If you are going to use this in the company, think again. You charge for something as obvious and important as a receipt. You refer to the website to download the receipt. Who does it on a phone? So parking lots where you want receipts become _very_ expensive. Which other companies charge for receipts?",1,2020-07-06,15.8.1,0.3527,,3194,neutral
3199,Pege2011,"Just to even get the idea to send push notifications? Ä with advertising? FASTEN that I turned off advertising, you send a lot of SPAM WHY in h-e should I need to contact your support to get rid of shit advertising",1,2020-06-16,15.8.1,-0.6697,,3199,negative
3200,thadvnt79,"Used EasyPark's GPS positioning to find the parking lot. After the app identified exactly where I stood, I started parking. This resulted in a fine as EasyPark had marked the wrong tariff / code. They take no responsibility at all for this. I'm far from the only one who has been affected. Feel free to read other reviews and other users' experience of EasyPark on e.g. trustpilot. I see that I have received an answer from the app developer. You should be extremely aware that the information presented in the app is not as simple as the app manufacturer wants it to appear. Also, do not forget that EasyPark makes its money regardless of whether you as a user are fined or not. But that says something about a parking company whose vision is to improve ""the Urban Experince"" instead of having the vision to help users easily park correctly and ensure that parking fines are avoided. I want to claim that EasyPark's GPS function helps to do the opposite and there are several reviews here from people who have experienced the same thing as me. In addition, the name of the app contributes to the problem, as it is promised to be simple, but in comparison with other services, it is the direct opposite. After further answers from where you claim that you want to try to help your customers as best as possible, the statement remains that you fail with it quite often (by the way, still looking for the Gallup survey that you refer to on your website regarding customer satisfaction). And ang. If I have been in contact with your customer service, yes of course I have. At first glance, it looks like a professional answer, but for anyone who has parked at some point and then been fined, I dare say that your answer is perceived as extremely condescending. For those of you who read this review, really take a look at other people's reviews also regarding EasyPark and its app and think about whether there might not be a better alternative when you park. (For example, a company that also takes care of the fine and in this way actually has a much greater responsibility and thus better opportunities to really help parking customers than a company like EasyPark). What if I had to pay the actual fee to EasyPark even though I was fined? Of course I got: /.",1,2020-06-12,15.8,0.9952,,3200,positive
3203,Lasse bredband,Adding a transaction fee of SEK 3 to email a receipt I think is a pretty bad approach that really annoyed me. I choose parkster every time if I can who does not have this öht.,4,2020-06-01,15.7,-0.4927,,3203,neutral
3208,1a tlll Easypark,This feels like an app where you deliberately try to deceive the users. Unnecessary number of keystrokes are needed to activate the parking and it is easy to believe that you are ready even if one last confirmation is needed. The result is unnecessary and unplanned parking fines for customers and extra income for EasyPark. Sharpening.,1,2020-05-22,15.6,0.6705,,3208,positive
3211,Lambett,I would like to use the function that warns of active parking when I leave with the car. But that means that the app consumes a lot of battery (85% of battery usage).,3,2020-04-19,15.4,0.3182,,3211,neutral
3213,Pooping Elephant,High service fee and you do not print what it will be in a parking lot either. Only total price.,1,2020-04-15,15.4,0.0,,3213,neutral
3220,nötabo,Would park in Malmö and therefore downloaded the app. Worked perfectly. Drove on and would park again and then it did not work. Tried 3 times with error message before I slipped into the store 10 min. Of course I had received a parking ticket when I came out. Called the parking company who said that I should have downloaded the Apcoa app and tried it when the EasyPark app failed.,1,2020-04-03,15.4,-0.2023,,3220,neutral
3226,Frimant,"Will of course use the competitors' parking apps that give me a receipt without costing me money every time. An emailed receipt costs nothing and charging for it shows that you certainly have to pay extra for other things as well. One answer only makes it worse, because I did not see any of what you are talking about when I needed the receipt !!!",1,2020-03-06,15.2,0.0,,3226,neutral
3227,samstaappen,Most difficult to park of all. Could not change payment method by phone. Have had to do from the computer.,1,2020-03-03,15.1.1,-0.4201,,3227,neutral
3228,OrvarByman,"This app has fined me two days in a row.One time the area code was changed even though I had keyed in correctly.The second time, the parking lot closed by itself, although I set the end time later.I will never use this again!",1,2020-03-02,15.1.1,0.0,,3228,neutral
3231,visselblåsaren,"I think the receipt service is swaying and I think it is substandard that you have to pay 3 kroner to access a receipt!Maybe there is an opportunity to get over the free receipt in some way, I have not succeeded despite several tentative attempts!The receipt service should be simpler / clearer",4,2019-10-29,14.3,0.6062,,3231,positive
3235,cassandramelodie,"I really love the app. Most things work perfectly, but PLEASE make sure that the app directly finds where I am, I now have to manually ""pull myself"" on the map from Germany every time. Crazy annoying. Feel free to fix and I will change my review 😉😉❤️❤️",4,2019-10-23,14.2,0.8828,,3235,positive
3241,Hadar Cars,"Would be good if the app did not forget where the car is parked in the same second as the parking goes out. If you happen to pass the time, you must try to remember which street the car was on in order to start a new parking lot.",4,2019-08-29,13.9,0.5523,,3241,positive
3243,Björn S,"Good app, but in Malmö it has no control over times for environmental parking, ie when the street is to be cleaned and there is a parking ban. Half a day a month, easy to miss. If you buy a ticket at the vending machine, you will be notified. Should be fixable in the app system as well.",3,2019-08-16,13.8,-0.2846,,3243,neutral
3244,Hritul,"Previously discovered that easypark is sometimes significantly more expensive than the regular rate. Update: I received a late reply to this review that the parking cost is the same as on the sign, but that is not true when I called customer service about another parking, EasyPark always adds 15% in service fee in addition to the parking cost. And I unfortunately do not remember exactly which parking space it was that I experienced more expensive taxi, except south of south.",3,2019-07-18,13.6.1,-0.7268,,3244,negative
3248,Niklas O,"Uses the app frequently but sees opportunities for improvement. Then I do not get the app to work when I want to charge my electric car. Unable to start parking. And if I change from swish to card, I get an error message (error code 1). Regular parking works without problems. Desires: * Easy way to see the hourly rate for parking. * Why can you not start a booking without an end time? Now you always have to keep track of when the parking goes out, which can easily be avoided with this function.",4,2019-05-11,13.1,0.817,,3248,positive
3249,metmike,The highest rating will be when the app is compatible with Apple CarPlay,4,2019-04-15,12.7,0.0,,3249,neutral
