ind,userName,content,rating,date,reviewVersion,compound,sentiment ,Unnamed: 0,sentiment
5152,Sopasa,"The business model doesn't convince me. A minimum of € 0.49 is always due per parking session. But if I only park for € 0.90, that's over 50% more that I have to pay. Then rather change",2,2014-07-11,3.8,-0.2429,,5152,neutral
5156,Der Don Martin,Parking in cities like Berlin has become really easy. I can only recommend.,5,2013-01-16,3.0,0.8016,,5156,positive
5159,C.Schulte,"Great app, I've already been able to save a few euros with it. Keep it up! AppleWatch support would be great!",5,2016-11-14,5.8,0.9401,,5159,positive
5166,berlinerschlawiner,"Mobile City / Smart Parking was taken over by Easypark, so that you are now forced to switch to the much worse app instead of integrating the old one. With Mobile City, the surrounding parking zones were simply displayed, so that you only had to tap on the street and then on start. Complete.At Easypark I first have to look laboriously on the map to see what the current zone number is. At Mobile City, I could just park on it and quit when I was done. At Easypark, I have to decide in advance how long I want to park, using a completely coarse and cumbersome dial. I miss to extend - bad luck. Pay again. Mobile City had a widget that let you quickly call up the ongoing parking process from the lockscreen. At Easy Park? Nothing. Easy Park also has high hidden fees, so you think twice about which service you want to use. This means that the added value compared to the parking machines (fast and real-time) is no longer given.That's really a pity!",1,2016-11-25,5.8.1,-0.6571,,5166,negative
5167,saminegm,"You can - contrary to what a previous reviewer said - end the parking time early, but the rest is crap: cryptic warning messages when the program starts, the GPS recognition of the location never works, the alleged SMS 15 minutes before the end of the parking period does not come and knows when the internet connection is interrupted and reconnect the app. not whether the parking process is still running, which is why you can neither extend nor terminate it. Scrap metal.",1,2013-03-08,3.0.9,-0.8772,,5167,negative
5168,jes-edv,"It's a shame that the app has only been optimized for newer iOS versions. iPhone 4 owners are smeared again. I'll probably switch to something else. This is how you offend your customers. This is really the last one, an absolute no go. And the app was already sluggishly slow anyway. Even with a clean 3G connection. Unfortunately I can't recommend it any more! So I'm not going to buy a new cell phone.",1,2017-11-07,10.0.1,-0.681,,5168,negative
5170,vstollberg,"I think the app is good, registration was problem-free, additional costs are acceptable because I primarily use the app for business purposes, for this reason I would urgently like a receipt by email for every parking transaction with regard to the billing.",4,2013-03-07,3.0.9,0.7717,,5170,positive
5172,Glotze24??,"I like this app. If I still got the sticker, it would be five stars.",4,2013-03-18,3.0.9,0.3612,,5172,neutral
5173,Der gute Meikel,"I park my car. I think I need 1 hour and because it then takes longer, when I think about it, I start playing with my cell phone while talking to extend the parking time. With Smart Parking, why could I just say I parked and when I drove away I ended the parking process. Why does a time have to be selected?In addition to the pathetic pink design with the embarrassing guy, a great step backwards. Congratulations. On the other hand, it also has to be an app. Designers give who work completely past the customer.",1,2017-01-21,5.8.4,0.8779,,5173,positive
5176,Ldflight,"The mobile city app ran smoothly and was easy to use. This one from EasyPark is unusable junk. No map display for the parking zones - no, I'm not buying a new iPhone just for this app - the fiddly turning wheel is annoying. If I have to determine my parking time in advance and then also have to pay, then the next thing I have to do is walk to the parking ticket machine to find the number of the parking zone, then I can insert my two coins there, I can save myself this app. The thing is a nuisance and a deterioration.",1,2016-12-19,5.8.3,0.2732,,5176,neutral
5177,tigerbeatz,"It's okay if you really don't have any change on hand, but then booking the ticket is considerably more expensive! e.g.: Normally 1 € for an hour costs 1.49 € via the app :-(",3,2015-09-18,5.0,-0.2481,,5177,neutral
5178,sauss......,"Until the last update, I was super satisfied. After the last update, I think the design is very bad and there are also errors in the display.",2,2017-11-28,10.0.3,0.1298,,5178,neutral
5179,Dh1223,App still seems to need a lot of improvement! Password change where? Save login data? Nothing! Always have to be re-entered. Address stored incorrectly. Cannot be corrected with the app. Have been using easypark for a long time via mobile phone and will continue to do so as long as the app doesn't slip. I agree with him! The forgotten password function does not work either!,1,2013-12-14,3.4,0.6925,,5179,positive
5180,Mr.Kane,"Parking periods are not stored, so you pay when you don't actually need it! In the app, the fees are not mentioned at all and cannot be traced back to the parking process. The move from mobilecity to easypark took place without being asked and with direct transfer of the personal data!The app itself shows a different parking zone on the map during the first tests",1,2017-05-24,5.8.6,-0.3099,,5180,neutral
5182,Zeichner01,"Quarrel with police officers and traffic tickets threatened ... Today I barely managed to avoid a traffic ticket twice. And only because I happened upon it when the police officers were checking cell phone parking. Easypark logs you into the wrong parking zone. I was standing in a 2-euro parking zone in Berlin and Easypark had automatically set a 1-euro zone. There would have been a ticket every time.MobileCity, on the other hand, was a wonderfully functioning app.Hands off!!!",1,2016-11-23,5.8.1,0.2358,,5182,neutral
5185,:TuXx:,"After they bought MobileCity, my user account was transferred. Then I looked at the settings. Apart from a horrible pink design that burns in your eyes, this service would also like to charge monthly fees and in addition to the parking process requires € 0.20 for an automatically (!!!) generated PDF confirmation by e-mail, and nothing more contemporary € 0.20 per SMS. In addition, you now always have to specify an end time and can no longer pay as long as you have really parked.I sorely miss this function in particular.Even if they are on their homepage about everything exactly so that we have it no longer exists. I think I'll close my account, so it's no good to me. I used mobile parking about once or twice a month, but I don't pay a basic fee! In summary: basic fees, excessive service fees and essential features removed, even if they are still there but we don't have them.",1,2016-11-23,5.8.1,-0.6601,,5185,negative
5186,Avsfdehed,- I first registered with EasyPark via the PC and entered a different phone number than the mobile phone. Was it then possible to connect to this userid in the app without entering a password ... Security error?- Very expensive (at least 50 cents per parking process for a small app and a database behind it ...)- The user interface is probably built for women (pink and pink)- ...Too bad it could have been a good idea ...,1,2017-01-04,5.8.3,-0.1531,,5186,neutral
5187,Aquaa_de,"Unfortunately, the app hangs up on iOS when you open the help function - you should now estimate your parking time beforehand, what is that supposed to mean ??? A simple start of the parking process (as with Mobilecity) would be enough.I'll check back in a few months to see if anything has changed ...",1,2016-12-01,5.8.1,0.212,,5187,neutral
5191,schwarzer T,"Terrible support ... Changeover from ""Mobile City"" to this operator allegedly did not work due to incorrect data transmission. But help from the support? ... Transfer the money back? 🤔😂 😡Due to the inadequate support, pricing policy ... 1 ⭐️ Too much, then I would like change with me",1,2017-02-13,5.8.4,0.9367,,5191,positive
5193,Kaschulski,"Moving from Mobile City only brings disadvantages for me personally!I get eye cancer when I switch it on.The color is impossible!The old solution - log in, log out was super easy! I often don't know how long I'll be staying and turning the clock forever is just a nuisance. The push notification about the end of the parking time is easy to overhear. The app is user-unfriendly.If I had to use it privately, I would definitely look for another alternative!",1,2016-11-23,5.8.1,0.8302,,5193,positive
5194,bastri96,"To date, I've used the app every week without any problems. But since today nothing works anymore. I am very angry and hope that the problem will be resolved quickly!",1,2016-06-29,5.5,-0.4228,,5194,neutral
5195,Lauriij,"Unfortunately, a system change has been going on in Northern Europe for over 6 weeks and the system administrators cannot get the problem under control. As a new customer, the app cannot be used because it sends SMS but cannot recognize and assign the mobile phone - error message. Only the hotline works there. Login on the website is also not possible. The app works for old customers.",1,2012-01-04,1.1,-0.5605,,5195,negative
5201,Andreas Boller ,"Unfortunately, a system change has been going on in Northern Europe for over 6 weeks and the system administrators cannot get the problem under control. As a new customer, the app cannot be used because it sends SMS but cannot recognize and assign the mobile phone - error message. Only the hotline works there. Login on the website is also not possible. The app works for old customers.",1,2014-01-31,3.5.1,-0.5605,,5201,negative
5202,UserFMG,"Good app, good idea!",4,2013-01-11,3.0,0.7263,,5202,positive
5204,Bukrelaus,"Very good app! Absolutely problem-free handling, very clear and exact invoices!I can only recommend it!",4,2017-07-27,5.8.9,0.8577,,5204,positive
5208,Schmackes46,It would be better to start the parking process at the push of a button even without a time preselection.,2,2017-07-12,5.8.9,0.4404,,5208,neutral
5209,Koelner68,"Good idea, but at least 49 cents per parking session is far too expensive. If you take the 15% it becomes even more expensive.So, delete it and goodbye",1,2013-06-27,3.1,0.2382,,5209,neutral
5210,CB-Berlin,"App no ​​longer works after update. Remains in the start screen. Great measures. Before everything went perfectly. Please leave your fingers if everything goes well. Now you need change again for the parking machine, great, thanks essypark!",1,2013-05-25,3.1,0.9558,,5210,positive
5211,needful,"Provider has taken over mobile numbers and thus forced this app on me. With mobile numbers, I started a parking process in a few seconds. A parking zone (Cologne) is rarely found here and must then always be entered manually. Setting the time with the rotary wheel is a good idea, but poorly implemented. The alternative is tedious too. I cannot park without a preset parking time. And the colors are horrible - a matter of taste, but too bright for a ""serious"" app.",1,2017-01-08,5.8.3,-0.3071,,5211,neutral
5212,Quantenphysik,The new app or the version after the update only works with a lot of patience. long The app hangs permanently. The touch screen does not respond at all. A quick parking process cannot be made with the app. Let's hope for an update. So unfortunately for the garbage.,1,2017-11-06,10.0.1,-0.0557,,5212,neutral
5214,netsrac,".... and that is the determination of the position of the parking zone. I am still one of the customers of the very first time and can hang the parking zone directly on a telephone number to park with it. Thanks to the choice of language, this is extremely fast. An app has to offer a lot more to make it attractive. This includes: - the zone determination by GPS- the valid tariff in the zone (so that you can estimate what the parking process will cost)- in what time must be paid in the current zone- Cost history of the last parking processes- Start and end parking (without time preselection) just as you can do it over the phone- Park reminder via push notification so that you don't forget to log out or when the parking time expires. Waiting for version 2.0 - but there is only one star!",1,2011-08-29,1.1,0.7488,,5214,positive
5217,msdv1970,"I used 'smartparking' from MobileCity before. The old app was considerably better - unfortunately MobileCity was migrated to this app. The use of EasyPark is considerably more complicated, you have to specify the parking time beforehand, the search for the zone is annoying and many standard settings (such as the car) have to be selected separately.",1,2016-12-17,5.8.3,-0.2893,,5217,neutral
5219,uricu,"I can from this app. only advise against. The login does not work even though the login information is correct. It works on the homepage. The predecessors of EasyPark had clear, functional apps. This one went completely wrong because of the unpleasant coloring. So ""Back to the roots"" and always some change for the machine in your pocket.",1,2013-03-02,3.0.9,-0.5984,,5219,negative
5223,Frog Tom,"... at Hanover Airport, the app prompts you to leave a handwritten note ""Handyparker"" in the car. - You feel really at home here ... in the digital age. And would like the good old change in your pocket or the credit card slot at the machine, because that would have deterred you from attempting ""easy parking"". To ask? :)",1,2014-07-02,3.8,0.9136,,5223,positive
5224, Chrizz1185,"The login does not work, in contrast to the website, where it goes. So my data is correct. I am a former customer of mobile numbers. The color of the app is hideous - a matter of taste. App deleted, I will use the phone again. Although the ""friendly voice"" sounds more like a prison guard. Overall, mobile numbers seemed much more serious.",1,2014-02-13,3.5.1,0.235,,5224,neutral
5227,PW.V,A very useful app that makes mobile parking even easier. We recommend! But I still have two suggestions for optimization: Automatic parking zone recognition via GPS (saves walking to the parking meter to read the zone)Notification of the calculated parking fees at the end of the parking process,4,2011-08-11,1.0,0.8146,,5227,positive
5229,Skat-Man,"Total junk! If you get the request to put ""park your mobile phone"" in the windshield, you will not be offered a ""next"" button, but only a cancel. This means that the app prevents you from taking a ticket and you stand there without any ticket! Incredibly bad and only annoying if you downloaded the stuff extra",1,2017-05-26,5.8.6,-0.9076,,5229,negative
5230,Quecki,"Apart from test cars in ""Explore the app"", I unfortunately can't park anything. The registration cannot be completed, the super informative error message ""Oops, something went wrong"" does not help at all! Yes, what please ??? After several attempts on different days (. ""... try again later"") I have some change ready. Annoying.",1,2017-10-10,5.9.1,-0.3798,,5230,neutral
5232,JulLieRin,"The app itself is first class, especially in Denmark, you save the change for the parking meter. Only since a few versions I get an error message when I want to recommend the app “Oops !! Something went wrong. Try again later. ”It has to work better.",2,2017-10-06,5.9.1,0.5696,,5232,positive
5233,momaoma,"Compared to high fees. Why you have to set the parking time is incomprehensible. Anyone who has been taken over by Mobile City as a customer feels ripped off and just wants to leave. However, customer service responds immediately to a cancellation with a confirmation of what is best to report.",1,2017-03-19,5.8.4,0.6124,,5233,positive
5236,Ghjggjcfg,"Good idea, I would like to use it. But I think 15% fees are too high. Then better with advertising.",1,2015-06-07,4.5,0.7615,,5236,positive
5239,Greg2508,I have been debiting the basic fee twice for the last 4 months. Every time it is said that this will be changed and credited or you would receive a callback. None of this happens! The cancellation is in progress and debits are now also being requested back. Idea is great - customer service is junk!,1,2013-07-10,3.2,0.8745,,5239,positive
5240,molto grazie,"no need to have change with you, no always running to the car, just stand up and type in where you are. and the political dinners stay away ...",5,2013-03-06,3.0.9,-0.5267,,5240,negative
5243,humaxel,"The app is great because I never have change with me anyway. In addition, you can easily extend the parking time.Gladly even more cities ...",5,2017-05-19,5.8.6,0.802,,5243,positive
5246,reneseance,"A minimum fee of 49 cents per parking transaction does not make it easy to use this app ... and without competition, so a kind of monopoly for such a service ... hopefully there will be more competition",1,2013-03-01,3.0.9,0.0757,,5246,neutral
5247,Chefkoch999,"Used for the first time today. Easy to use and the rescue if you don't have any change with you. Unfortunately there was an error message with Paypay payment, but a point deduction. In terms of price, I have no comparison.",4,2017-08-24,5.9,-0.3071,,5247,neutral
5251,REOB81,"I have no idea if it works, 2 things immediately scared me off:a) you pay 15% of the parking fee (or at least € 0.49) moreb) I should have put a note saying ""Mobile Parking"" behind the windshield in my parking zone. I would only use the app if I a) have no way of paying at the machine (ergo no change) or b) absolutely cannot estimate my parking time. Otherwise: no way!",2,2015-09-10,5.0,-0.8858,,5251,negative
5253, lena_alona,"A minimum fee of 49 cents per parking transaction does not make it easy to use this app ... and without competition, so a kind of monopoly for such a service ... hopefully there will be more competition",1,2013-12-13,3.4,0.0757,,5253,neutral
5254,asb311,"Of my 70 apps, this is the slowest. Billing is incorrect, no one replies to emails and the help link hangs up. It's a shame, the idea is good.",1,2013-05-04,3.0.12,0.0772,,5254,neutral
5258,Dülmener,The idea is good! Implementation could be better. Why is it not possible to use GPS to identify my parking zone? So I have to walk to the machine every time to find out the parking zone! Price way too expensive !!!,,,,0.7887,,5258,positive
5265,NorPhiLau,"As a long-time satisfied user of mobile numbers, I was inevitably transferred. This app is the ultimate joke. A major disadvantage of mobile phone parking is that you can start and end parking processes manually and do NOT have to determine beforehand how long you want to park for. This ridiculous app no ​​longer offers that advantage. It differs from paying at the parking ticket machine only in that additional fees apply. After parking my cell phone for a long time, I will again pay manually at the parking ticket machine. It's cheaper. How one can make a ministry so bad is a mystery to me. This is how mobile phone parking will never establish itself. Where should the advantage be?",1,2013-03-07,3.0.9,-0.6965,,5265,negative
5269,Raz307,When will GPS tracking finally work?Also received tickets despite bookingSystem immature,1,2013-10-23,3.3,0.0,,5269,neutral
5276,Mr. Monst@,... you could park there without setting the time. I am now using change again. Pity!,1,2017-04-02,5.8.4,-0.3595,,5276,neutral
5282,MichiKöln76,"Since the app was updated, it may look better, but it keeps crashing and inputs are no longer possible. After various attempts, it will eventually settle down.",1,2017-11-06,10.0.1,-0.2144,,5282,neutral
5283,Rahebo,"was this necessary? The app. Mobile numbers was completely easy to use and completely reliable. Now some idiot has tinkered with it again and nothing works anymore. Since I have the previous app. I've often used it professionally, I'm really pissed off.The requested stickers do not come either. Calls to the hotline are also ineffective. There are no recalls !!! This is how stupidity breaks a good idea. In addition, the following is the company's answer: ""I closed your customer account immediately - I'm sorry,that we have ""bothered"" you with our bad product.For further information I am gladly at your disposal."" This shows the arrogance of a company that does not understand the subject of customer satisfaction.",1,2013-03-26,3.0.9,-0.9198,,5283,negative
5287,Anna Magdalena Notebook - Interpret J.C.Martins,"New version, old bug. Location detection extremely weak. Scrap metal. It's a shame about the beautiful idea!",1,2014-01-20,3.5.1,-0.3989,,5287,neutral
5289,cgn 564,The parking zone search in the city center of Cologne rarely works. This weak app cannot find the most famous streets. I only have one vehicle and yet I always have to select this one identifier first. Programmers obviously do not live in Cologne and will certainly park themselves with a better app,1,2017-05-26,5.8.6,0.2323,,5289,neutral
5291,BrunoKlotzer,Everything was fine under mobile City. I do not understand why one cannot build on the tried and tested. After several attempts I will uninstall the app and hope that there will be an alternative in the near future.,1,2016-11-28,5.8.1,0.5719,,5291,positive
5294,FrGeWe,"- Registration does not work despite correct data- App. keeps asking for GPS access despite sharing, and that with the path to the website- App design and color scheme. looks very dubious. I can also do without ""turning wheels"" for preselecting the parking time- The app. the predecessor ""Mobil numbers"" was much better and served its purpose. In addition, it was possible to reserve parking processes with this provider via web access.- Finally, I run back to the machine and can call the provider and the app. only advise against.Addendum April 2013:Despite the cancellation, the debit will continue.Tariff cannot be changedAccount details cannot be changedBravo!!!",1,2013-04-06,3.0.10,-0.4768,,5294,neutral
5305,JuliafromBerlin,"Basically a nice idea, but service fees that are way too high and cumbersome to use! No recommendation!",1,2017-08-09,5.9,-0.3578,,5305,neutral
5308,xordinary,"First of all, after two years on the market, it is still not adapted for the big iPhones. That is really no longer possible! Second, if you made a mistake during registration, there is no way to change the payment method as there is no back button. It just remains to be thrown down and reinstalled. And please: at least 49 cents ""transaction fees""? Who is so stupid and participates? Not me. Turned off ...",1,2016-07-01,5.5,-0.9003,,5308,negative
5313,Nikolaus Kopernikus,"Compare the parking fee with what you would pay in cash!In my case 178%! No thank you.I would have grudgedly accepted a 10% service surcharge, but that's a farmer's trick!",1,2017-08-29,5.9,-0.2917,,5313,neutral
5317,Holle36,Didn't think that a really well-functioning system (Mobile City) can be deteriorated like that.,1,2017-03-26,5.8.4,0.3612,,5317,neutral
5327,Dogus85,Great thing I used it today and I am super satisfied I can recommend it.,5,2017-06-13,5.8.6,0.9231,,5327,positive
5331,MisterLeo123,The time setting via the WHEEL is something for play children and annoying when you specify longer parking times. Clear information on parking times would be better or a button for maximum parking time. App loading times. are very long. Then I get a 99 on the icon of the program. This gives the impression that I have 99 messages. But I can't find something like that in the menu. I think the app. Moves me to switch to another provider.,1,2013-04-05,3.0.10,0.0989,,5331,neutral
5332,Fox Entertainment,"Instead of paying € 1 for an hour, they want € 1.49 I think that's tough!",1,2015-06-05,4.5,-0.126,,5332,neutral
5333,Bea1144,"The app. crashes when selecting the parking zone. Such an app. makes no sense. Fortunately, there are no fees and the app. is free. Otherwise I would be even more angry!",1,2012-02-03,1.1,-0.6105,,5333,negative
5341,Muhmaaldiemu,"I liked the old version much better. All favorite parking zones ... out!Select setting of the parking time (optics digital or analog) ... no longer works! Eye cancer in pink ... for free! Man guys, the app was so good. It's just a shame that you decided according to the motto “optics before functions”. I very much hope that you can restore the functions and reduce the pink to normal levels again.",1,2017-10-31,10.0.1,0.9061,,5341,positive
5345,Jueson,"It would be great if it were debited from the cell phone - as it used to be. But without me, I don't want to give credit card data for parking.",1,2017-08-11,5.9,0.6825,,5345,positive
5348,HAJO_FRANZE,"In the beginning there was a great mobile numbers program with minor flawsNow taken over by easypark - new software - was more right than ..., well, initial problemsBut now - NOTHING works after the updatePlease do a little test before giving it out?Your program gods!Wouldn't it be nice for us users without change for the parking meter?I want to be credited with my € 2 basic fee for May and JunethanksFranze",1,2013-06-03,3.1,0.8575,,5348,positive
5354,maestroii,"you had to wait forever and then there is not even a position determination, very weak will quit and switch # App works terribly # Online portal no longer available, no invoices visible # excessive fees",1,2012-01-12,1.1,-0.8173,,5354,negative
