ind,userName,content,rating,date,reviewVersion,compound,sentiment ,Unnamed: 0,sentiment
3698,Gaggis,"New update: The app has been upgraded and is now close to perfect! GPS function has arrived and you can enter favorites. Glorious! EasyPark has saved me a lot of money and paying for parking has become almost fun!  Update of previous review: Yesterday I sent a new email about a non-functioning app to EasyPark. I got an answer today and during the day and after a reinstall today it works again! Brilliant!! Also get a receipt on sms !! Now only GPS function is missing so the app gets top marks from me !!  Previous mention: I use EasyPark diligently and have saved large amounts on parking. Arguments that it costs a lot to use EasyPark do not hold if you park a lot and for example are a lot in meetings with a somewhat uncertain end time. EasyPark is an ingenious solution and the app worked well to begin with, but for far (!) Long now it has not worked properly. I wrote an email to EasyPark about this several months ago where they replied that they are working hard to fix this. It turns out (obviously) that is not true. The concept is ingenious. Had the app worked, it would also have been ingenious, but now I only use the ring solution until further notice. When the app is updated and the receipt + GPS function is also included, the app gets top marks from me, but when will the app be usable again ..?",5,2013-01-10,3.0,0.9256,,9095,positive
3699,lrg,Should support the iphone 5's screen size and the wheel is more design than function.,3,2013-01-10,3.0,0.4019,,9096,neutral
3704,Bårda,"An app that has something for it!  But I can not add more cars, have registered one car but can not add the other! Which means that I can not use the app as intended. (in the picture I see there are several registration numbers, but not with me)",2,2012-12-11,2.2,0.0,,9101,neutral
3711,Pompelnikkelfisk,"Who will pay several hundred kroner for a membership where the only advantage is to be allowed to PAY parking ?? Incomprehensible to me at least. Smartpark in Trondheim, on the other hand, has taken the consumer seriously. There you are in seconds without having to call and sign up for membership.",1,2012-06-26,2.0,0.3241,,9108,neutral
3718,Maxxxxfdjknxtfsafkkggtnjfg,"..... with some shortcomings. Agree with the other reviews, and think the most important thing is to get up what the parking costs. Should be a setting where you could ""force"" it to use 3G, as it does not always manage to communicate on wifi. Also, it should have push messages",3,2011-09-15,1.1,0.5563,,9115,positive
3720,mlegendre,What f? NOK 325 to register? I think I stick to the sms function!,1,2011-08-30,1.1,0.0,,9117,neutral
3729,mbigboyny,I think it was very super mega super BRRRRRRRRAAAAAAAAAA !!!!!!!!!!!!!!!!!!!!!!!!!!!!!!!!!!!!!!!!! !!!!!!!!!!!!!,5,2014-10-06,3.9,0.8891,,9126,positive
3733,Rafael Requena,"Without any kind of warning, the app has hung, it has not taken my ticket and when I got back to the car I had a 60 euros fine ... and now what do I do? ... the responsibility is mine of course, I use an app that fails and I am fined ... because we have an app that is left over and does not do its job well, so I recommend everyone to desist if they do not want to pay undue fines",1,2021-10-11,15.28.0,0.0668,,9130,neutral
3734,Luis Tori,"Application with 10% commission and excessive minimums. I feel cheated by the app since I went from e-park to easy park when it was absorbed thinking that they would maintain the same conditions and I find that this app charges brutal management commissions after 1 year and quite covertly, since Either you give the payment detail at the time of parking or you don't even know about it. I have searched and there are apps to park in Madrid without commissions, so .... Goodbye Easy Park.",1,2021-10-08,15.27.0,-0.5325,,9131,negative
3737,Victor Manuel Corcoles Cutanda,"Very easy to use. I have been using this App for more than 4 years. Easy, intuitive, it works well ... I have saved 3 license plates, because I use three different cars. I have never had any problems. Even when the credit card has expired, I have been provided with the instructions to change the card. Congratulations to the EasyPark technical group.",5,2021-10-07,15.27.0,0.9568,,9134,positive
3751,Alquiler Audiovisual AZ,"Please. Do not lie. In Santander (I don't live there), but, on vacation, you can recharge your balance countless times in the same geolocation. Then they give you a fine, it turns out that you allege that there is a small print on a corner and it says that you have to change the street car so that you do not get a fine since there is only one area. Result: fine + no return of money paid to Easypark.",1,2021-09-30,15.27.0,0.0931,,9148,neutral
3756,Antonio FY,"It works very well and its activation is very fast, if it were operational in Alcobendas it would be ideal",5,2021-09-29,15.27.0,0.6997,,9153,positive
3772,Laura Durán,"To begin with, I could not transfer the balance from e-park to easypark. In addition, the app is more complicated by having to use location (which does not always work) and not only with the license plate, as was the case with e-park. Finally, the 10% recharge seems excessive to me. In short, I would not mind paying a surcharge if at least the app will work well and more intuitively. The older people I know can't get hold of it.",2,2021-09-22,15.27.0,0.2732,,9169,neutral
3779,Elena Fernández,"Updated on 09/20 in response to the comment: in the starting price of the app, I was already charged more than 8 euros for 4 hours. in the blue zone, to which your service cost was added. However, the 10% bonus appeared on the machine and it dropped to € 7. I had to use the app because the machine did not take the card. I insist: bad app. My car is new and has a 10% discount when parking in Madrid. It has not been reflected in the price they have charged me. I will not use it again.",1,2021-09-20,15.26.0,-0.3818,,9176,neutral
3781,Pepe Quemasdá,"It does not allow to disappear in Gerona. It is embarrassing that you do not have this option that you did before. If you park thinking that you can stay up to 2 hours, but in 10 minutes you are there, you lose everything overpaid. A shame of usury on the part of EssyPark. The towns that use the app are not marked on the map, not even the affected payment areas. For me very bad app and service.",1,2021-09-19,15.26.0,-0.9328,,9178,negative
3782,Álvaro Ortiz Grinda,"My first experience was bad, but after talking to customer service they have satisfactorily resolved the problems I had and now I see the app perfectly. I totally recommend it",4,2021-09-19,15.26.0,0.879,,9179,positive
3783,Miguel Angel Segovia,"Easy to use, fast locating zones and alerts you before time runs out. 100% recommended Today 9-17-21 I ran out of balance on the card I use for this, the system stopped my account, I recharged it and in 1 minute it was activated again, it saved my day and I was able to continue working. Oh, and I don't think it's bad if they charge something, the work has to be paid for and with what makes it easier for us not to have to look for the machines it deserves it, I will continue to use it, THANK YOU VERY MUCH FOR THIS APP.",5,2021-09-19,15.27.0,0.9258,,9180,positive
3786,Ana S,"I had to explain myself wrong in my previous message. What happened to me yesterday is that the system did not notify me of a voidable sanction, as it indicated to me when I put the license plate of my car there was none, something uncertain because it could have been canceled. Regarding my other criticism about the system not allowing to stop when it clearly says ""stop"", nothing has been answered. Thanks. I'm not from Madrid, I'm from A Coruña. But if it cannot be stopped, the app will have to be changed and not implied that it can.",1,2021-09-17,15.26.0,0.2702,,9183,neutral
3787,Susana Lara,Due to the malfunction of this application I have not been able to cancel a fine and now I will have to pay € 90.,1,2021-09-16,15.26.0,-0.1531,,9184,neutral
3792,Anabel Moral Marzal,"They could improve. When you stop the time because you already leave, the money that is left over could be returned to you. Since you are telling them to stop ... It would be a detail.",2,2021-09-15,15.26.0,-0.1779,,9189,neutral
3799,oriol cervantes,"It's horrible you get a ""code -1"" error that doesn't even let you enter, it doesn't give you solutions and you can't do anything, a disaster",1,2021-09-13,15.26.0,-0.8961,,9196,negative
3803,vicente salazar machado,"It is wonderful, I recommend it 100%",5,2021-09-13,15.26.0,0.7351,,9200,positive
3805,Manuel Pouso,"Very fast and very comfortable, I recommend it",5,2021-09-13,15.26.0,0.7474,,9202,positive
3807,Sonia Regueiro,"Good morning, I would like to know if in A Coruña there are surcharges or some type of commission in the parking lot and why they do not appear to me the day I parked. What day are they loaded? Thanks",1,2021-09-12,15.26.0,0.8074,,9204,positive
3821,karina garduño,"I am very annoyed with the application, it is unintuitive, unfriendly and misleading. It does not allow you to cancel the time, I just paid € 8 for a time that I am not going to consume, I should have been asked before if I agreed or not. And the circle with which it rotates to add hours is visually very pleasant but all it does is confuse you, they have already fined me twice for confusing me and I assure you that it is not because of stupidity, with the other application I never happened. I'd give it -10",1,2021-09-04,15.25.0,-0.0062,,9218,neutral
3826,agueda flores,"I have tried to change the payment method the way it is done and it won't let me. Please, how can I request it?",3,2021-09-02,15.26.0,-0.2411,,9223,neutral
3827,Jessy,Terrible. I increased the fine because my city did not appear in the drop-down list of cities to cancel them. I called to claim and they didn't give me any option. Just pay.,1,2021-09-02,15.26.0,-0.3818,,9224,neutral
3832,Armando García,I come from ePark and I see that we have lost functionalities with the change ... We have gotten worse. Acta could search the street and it was easy to put the end guide if it was at night or on the weekend ... The roulette that marks you hours that are not regulated ... Putting a ticket on Saturday for Monday is a bit hellish .,2,2021-09-01,15.26.0,-0.7717,,9229,negative
3842,Israel Sucias,"THE CARD WILL NOT BE ERASED Once inserted, it will not allow you to erase it",1,2021-08-28,15.26.0,-0.1695,,9239,neutral
3848,Blanca Rodriguez,"Very comfortable. I do not give it 5 stars because I have not been able to extend the parking time, which I could do with the app of the previous concession",3,2021-08-27,15.25.0,0.6478,,9245,positive
3850,Andres Arbelaez,"Previously I had e-park in my opinion it was much more practical than this new app, when canceling complaints you did not have to enter the license plate manually, the payment history was much more practical now at each end of the page when printing a logo appears that does not show the transactions carried out at the corresponding time, if these errors are corrected, I would use the App again and improve the score",2,2021-08-26,15.25.0,-0.296,,9247,neutral
3861,EUGENIO,"Commission too high, especially to park for a short time. Minimum 18 cents. There is no prepaid option, only PayPal or card, they ask you for too much personal information that I do not think is necessary.",2,2021-08-24,15.25.0,-0.296,,9258,neutral
3867,César Bg,"They erased the previous assessment, but come on, I once again put that with the mandatory change from e-park to this one, the balance I had disappeared, not to say that now they add costs that there were not before. An impudence, come on.",1,2021-08-23,15.25.0,-0.2263,,9264,neutral
3868,magdalena Moriche,I do not recommend it. They took away epark that was free and with this they charge us for the service. That which they said that in Coruña they were not going to charge. We don't deserve this.,1,2021-08-22,15.25.0,0.2937,,9265,neutral
3875,alejandro G,I consider it a scam to have to pay a commission of 10% + VAT for the use of this application. I use other blue / green zone payment apps in various cities in Spain and it is THE ONLY ONE that forces you to overpay. I will not use it again.,1,2021-08-18,15.25.0,-0.6249,,9272,negative
3878,Alberto Marchante Gago,"A bloody scam. In the previous application I had no management fees. At EasyPark every time you use it, they charge you a percentage! Take a good look. I do not recommend it.",1,2021-08-16,15.25.0,-0.8075,,9275,negative
3882,R. A.N.,"I do not recommend it at all, the previous application worked much better, especially for the wallet, which was loaded with what I needed, now they force you to put a card or PayPal, why is it ??? ... I had to remove the payment by PayPal. It does not work well. In a payment of € 1 for parking, I have received two consecutive charges in PayPal, one of € 1.70 and another of € 1.91. A total of € 3.61 for € 1 parking. Then I have canceled the payments with PayPal and uninstalled the application.",1,2021-08-13,15.24.1,-0.3948,,9279,neutral
3886,Paco Ram,"Incredibly, they do not send an invoice for the parking lots if you are not a company account (with cost, along with the fees for parking management). Legal? He gives me no. If they have charged me for a service, I have the right and they are obliged to issue an invoice, but they only send a receipt. Incredible but true.",1,2021-08-10,15.24.1,0.6082,,9283,positive
3894,Soraya Plaza,A lot of commission and sometimes you think you have put the ticket and it is not like that. It seems better than it turns out.,1,2021-08-05,15.24.1,0.1999,,9291,neutral
3910,Jose N.,"On July 29 I made my first payment in the blue zone, € 2.10 and I picked up my car before the time ran out. Well, since then and until today, August 2, they continue to send me daily payments to the card for the same amount. When my car is 100km from the area. I don't see that logical or normal. I give it a star for not being able to give it negative stars.",1,2021-08-02,15.24.1,-0.3818,,9307,neutral
3911,Sergio Ramos,"It does not seem difficult to handle, but it would be very useful for when you travel, to know the prices of the areas. The seety app already does it, I would like something similar to be incorporated.",3,2021-08-01,15.24.1,0.844,,9308,positive
3915,Julio Gilardi,I give it a star because I can't put less. In the previous application they did not charge you extra for parking while in this new one they did. As soon as I spend my transferred balance I will probably uninstall it.,1,2021-07-29,15.24.1,0.0,,9312,neutral
3921,Benji Molina,I do not understand why I have to locate the location. In the old app I only had to pay and that's it. Now I have to look on a map where I left the car and that is if I find the street.,1,2021-07-27,15.24.1,-0.1027,,9318,neutral
3927,Manuel Angel Rey Dopico,"Easy to use, fast and reliable. It also allows you to stop parking if you have needed less time than planned. It alerts you when the paid time is going to end",4,2021-07-26,15.24.1,0.1779,,9324,neutral
3933,Estrella Barbero,"Where is e-park? This is a mess I do not know, now I have to put the place where I am and place it on the map, I think it is very good for people who change province often but it is not my case, they could put it as an alternative option, Before I only marked commercial blue, marked the price, told me the time and run",1,2021-07-23,15.24.1,0.0891,,9330,neutral
3936,Miguel Angel Lanza,"The company's application that was purchased was easier and more intuitive, I would have given it 5 stars. This is more complicated and I doubt if I was correct when pressing and closing the car. Maybe for being in the 80s?",3,2021-07-22,15.24.1,0.0772,,9333,neutral
3959,Yggdrasil Ask,"You put e-park in the search engine, you install it and it tells you to install this other one. They start out well, but it will get better because the first thing you have to put in this is your credit card ..... with how well they reason to enter sensitive data before seeing that the application works and that they have the city that me interested.",1,2021-07-13,15.23.0,0.9325,,9356,positive
3961,Kiko de Arévalo,"Comfort, seriousness and a fair price. Although if it were cheaper, in these times, nothing would happen either ... hehehe. 🤷‍♂️",5,2021-07-12,15.23.0,0.5574,,9358,positive
3962,Marta,"Well, I was happy. But it gives you the option in the center of the screen to stop and when you give it (because you have been confused about the car or area ...) they tell you that it is not possible to stop it until the hour is up ... So?",4,2021-07-12,15.18.0,-0.1326,,9359,neutral
3964,Quique,"I had e-park and they force me to migrate to it by charging a commission, it seems like a scam, when the balance I have ends I will not use it again, I will look for another. That roulette does not work well for me either, there are times when after selecting the time it does not let me advance and it does not tell me the price and I have to go back and start over. In answer to what you tell me, on another day I tried to put it in for 1 min and it already charged me about 24 or 26 cents, I do not get the accounts of what you say.",1,2021-07-12,15.23.0,-0.5878,,9361,negative
3970,julian sanchez,"Good, but it would be better if it warns you with sound that your time is going to expire",4,2021-07-10,15.23.0,0.6369,,9367,positive
3999,Virginia Zambrano,"It is simple to use, eventually it has bugs and it gets caught. I consider that you should have the option to cancel the time if the parking time is not used and that they only charge you for what is used. I also recommend that if the time expires and you want to put the car parked in the same place again, it gives you the option to renew it without having to look for the car on the map. Sometimes I have not been around and it makes it difficult for me to find the street on the map.",3,2021-07-05,15.23.0,-0.1779,,9396,neutral
4001,Willy Pacheco,The best thing to do is kick the parking lot when you leave and they only charge you for the time you've been,4,2021-07-05,15.23.0,0.6124,,9398,positive
4003,Victor M.,"All wrong: - It is chosen for time, instead of money. With e-park you chose the amount to spend, and the app indicated the maximum time. In this other way, sometimes you pay the same for a certain time as for the same plus five minutes. - Minimum commission of 18 cents per ticket. Even if the ticket is for a couple of cents. In other apps like Telpark it is 3 cents (in Madrid). - It does not allow to eliminate the means of payment if you do not put another one. - There is no way to delete your own account.",1,2021-07-04,15.23.0,-0.4149,,9400,neutral
4004,Jero Ariño,"When you install the application it does not say that it has management fees. They have charged me € 0.44 for 2 hours of parking, which with another application would have been € 3.60 instead of € 4.04 that I paid with EasyPark.",1,2021-07-03,15.23.0,-0.2023,,9401,neutral
4006,SIMO M. LAFSIHI,"Terrible application, it lacks a lot and the by bag that it gives with the number of area. It could be a bit assimilated even a little to its predecessor ePark or El Parking. The map does not work well, and San Feliu de Llobregat always marks me regardless of where it is hahaha ... Disappointing.",1,2021-07-02,15.23.0,-0.4963,,9403,neutral
4008,Rafael Marquez,"It has nothing easy, this type of application e. Park specifically, which is the one I used, they are used to facilitate that if I am doing business and the time passes, you can get a ticket again from the mobile, and this application to do that, you have to call by phone or know you by heart the parking area number, or to be next to the car, so frankly it seems useless to me, when I finish the balance that I have pending I will probably uninstall it.",1,2021-07-01,15.23.0,0.0757,,9405,neutral
4012,Manuel González,It does not allow me to extend the time once parked. It gives me an error message.,3,2021-06-29,15.23.0,-0.3952,,9409,neutral
4013,Raquel Torres,"The application is deceiving. It seems that you can stay the time that you indicate but then, when you have already been charged, it gives you the real time. It does not offer the ability to cancel a payment if you make a mistake. Their customer service does not solve this problem and blames it on the city where you park. I will not use the application again.",1,2021-06-28,15.23.0,-0.9616,,9410,negative
4015,Julieth Zambrano,"I find it fabulous, you can stop the time if you leave earlier than planned. Invite a friend but we cannot redeem the gift",5,2021-06-27,15.23.0,-0.0539,,9412,neutral
4019,flor sanchez,"Lately as there are several nearby areas to park it does not locate you in the correct one. You have to look for parking meters and check. I mean, waste of time. They would have to improve localization",3,2021-06-25,15.22.0,0.0258,,9416,neutral
4023,Fernando Fernández Zamora,"After many years using E-park, I will use up the balance that I have left in this new application and I will uninstall it FOREVER, little intuitive, abusive commissions, I have to know a city code that only they know ...",1,2021-06-23,15.22.0,-0.6022,,9420,negative
4024,Miguel A. Cañadas Mercado,"Terrible and thief app. At the moment they are holding me hostage for the balance that I had in ePark, since they neither return it to me nor allow me to consume it in the conditions that I had in ePark when I recharged. Therefore, I will uninstall it as soon as it uses up most of that balance. Or maybe uninstall it before, since it is preferable to give a few euros to have something to do with rabble like this.",1,2021-06-23,15.22.0,-0.6874,,9421,negative
4026,Sara,"I just migrated my e-park account (since I had no other option) I find it embarrassing that with the good application that e-park was, in this new one commissions are charged (yes, I know that it is to maintain the app and blah blah blah) and be so convoluted. E-park was very easy and intuitive. They should give us the option to refund e-park balance. Without a doubt, as soon as the balance is exhausted, I return to the use of coins. I will inform myself to see if it is legal that they do not give us a return option.",1,2021-06-21,15.22.0,0.2739,,9423,neutral
4032,Sr. Pericoydg,"That you take a ticket at 06:00 in the mñm when the parking area begins at 09:00 and inadvertently make a mistake to give the car you had, if you have the option of confirming that it is that car and you have no option To cancel said ticket or to be able to modify the car is regrettable.",1,2021-06-17,15.22.0,-0.836,,9429,negative
4038,Francisco Carbonell,"The app is a scam. They charge e-park, an application without commissions, they force you to install this and they pass you all the outstanding balance instead of returning it. They tell you that they give you 3 operations without commissions, but there are only two. They charge you an abusive minimum commissions, being many times more expensive than the ticket. And they tell you that they charge you because they give you more options, such as expanding the ticket, but if you want to expand it, they will charge you the minimum commission again. And with respond to your email.",1,2021-06-14,15.22.0,-0.5023,,9435,negative
4040,Nagore Otsoa,"Magnificent application and with a customer service out of the ordinary, I am pleasantly surprised, that's why I recommend 100%",5,2021-06-11,15.22.0,0.886,,9437,positive
4042,Carlos López,"Still, when paying for parking ... it gives me an error code ...",3,2021-06-11,15.22.0,-0.4019,,9439,neutral
4043,Miguel Sanz,"06/11 Indeed I am writing from Madrid. I propose that when a server crash occurs, it is indicated in the error message, in words that users understand, type: At the moment the server is not working. Please go to the nearest parking meter. It would be great if you also indicated an estimated time of solution. 06/10 Total application failure, continuous message please try later. Shameful",3,2021-06-11,15.22.0,-0.6641,,9440,negative
4046,Oscar,"It works very badly, I have two parking tickets in A Coruña, € 60, and all for its useless application, a disgusting one. Either it does not connect, or you start paying for the parking and when you arrive you find the fine, it does not let you extend the parking lot ... And being the maximum parking period two hours they give you a margin of one hour to eliminate the penalty, That is to say, I pay 2 hours, or so I think, I don't worry and fine with no margin for correction, don't use it, don't risk piling up fines.",1,2021-06-10,15.22.0,-0.9059,,9443,negative
4049,Vicente Maroto Chandal,"Easypark not recommended for parking in Madrid, the old e-park application used for several years worked great, you cannot see the cost of parking before parking, a failure appears many times after parking the vehicle without recognizing the parking area. Final result fine one day and immediate uninstallation of the application and no recommendation to anyone. I will look for another better application.",1,2021-06-10,15.22.0,0.4035,,9446,neutral
4052,Jesus Alonso Puertas,"Frankly abusive. I have parked today and the detail is: Fee (that is, what would have to be paid at the parking meter) € 0.55, Easypark Commission € 0.18, Total paid € 0.73. I mean, I paid 32% for the service. It is clear, to the parking meter !.",2,2021-06-09,15.22.0,-0.4389,,9449,neutral
4053,Rober Ramos,"Good Morning. I would like to recharge my card, but I don't know how to do it. Grac",4,2021-06-09,15.22.0,0.4019,,9450,neutral
