userName;content;rating;date;reviewVersion
Usman Burki;Does the job brilliantly. Been using a number of years now and never disappointed. Thanks for a wonderful experience.;5;2019-10-31;4.89
Ola Sjögren;Parkeringen på Skøjtevej på Amager syns inte i er app. Mycket irriterande!;1;2019-10-26;4.89
Antonio Martinelli;This app is designed to get you a fine. Look instead for a manual payment by the parking lot. VERY bad experience with the app. I don't understand how Helsingør kommunen give them permission to operate.;1;2019-10-23;4.88
Margus Heilä;Works well. Finds me even the other app does not.;5;2019-10-19;4.88
Michal Brutvan;Great app, makes parking very easy. However, after I got a new phone and installed Parkman on it, I did not realize I had two cars in it after logging in, and the app did not ask me which car I'd like to park with. It somehow determined the car automatically, which was incidentally not the car I parked with. So on top of my 20 euro parking bill, I ended up with an 80 euro fine too. I'd say that's a very expensive UX issue.;4;2019-10-08;4.87
Waqar Altaf;This Is good app. But I dont know I have free parking but still company charge me parking fee. Thats really bad.;4;2019-09-17;4.85
Adrian Esanu;Small in size, intuitive, no ads and fast working. If you want to get the first parking for free, enter the following code after installation VXFU;5;2019-09-04;4.86
Petteri Bergius;Toimii erinomaisesti;5;2019-08-29;4.85
Pomor Ko;Pretty negative. I have Russian mobile number. Today came to Klaipeda and installed this app. It has rejected to work saying that its not working in my country meaning Russia. Location permit granted to this app.;1;2019-08-06;4.84
Narvydas;Get free 5$ for parking with my code LNRTZQ;4;2019-07-01;4.82
Denis Druqu;very good;5;2019-07-01;4.82
Svetlana Kicenko;Good!!! Tnx;5;2019-06-21;
P WS;The best parking app, hands down. Anyone who complains about the price has not used other forms of payment...;5;2019-06-10;4.82
Hai Bui;Best parking app right now!;5;2019-05-31;4.8
lmuszyns;Very convenient and i always find a place to park!;5;2019-05-30;4.8
Alex Inkiläinen;Great but charges are pretty high.;4;2019-05-24;4.8
Santtu Vuori;Jos lokaatio ei ole sovelluksen käytössä niin miksi silloin maksukortit ja rekisteröidyt autot eivät näy. rookie virhe minusta;1;2019-05-21;4.8
Kimmo Kinnunen;Toimii moitteetta;4;2019-05-13;4.8
Pete;Works very well, BUT (and this is a big one) charges you if you are parking during a time that the parking is free!!!;3;2019-05-01;4.8
Juha E;Car license number should be better shown if many vehicles. Wrong one easily selected.;4;2019-04-26;4.8
Eleonik 76;Horrible app. I have parked near Pasila using the app, with countdown on, and when my job was done, came back, stopped, the amount was about 6 eu, paid and go on. After a week I receive email, which claims, that I haven't paid. Right away called ParkMan, and the answer was simple. They were not charging at the same time, but once a month! Seriously?! How about if I use 20 parking, and each 10 eu? So have to pay at once 200 eu end of month?! Thiefs and crooks. Uninstall!!!!!;1;2019-04-25;4.8
Asus Prime;App is working well. Free 10€ parking for you with code: LEB6. Ihan toimiva appi. 10€ ilmaista pysäköintiä sulle koodilla: LEB6;4;2019-04-15;4.79
bykavka;(edited after initial slow response to support requests - was adderesed and solved). Good app for parking while travelling. Parking in Tallinn always gave me nightmares but ParkMan solves that beautifully. Probably won't use in home city as surcharge for short parkings is a bit too much. Other than that highly recommended.;4;2019-04-12;4.79
Sebastian Bergman;After you download and install use code LQQG - You will get your first parking for free up to 10€. Asennuksen jälkeen käytä koodia LQQG saadaksesi ilmaista parkkiaika;5;2019-03-28;4.79
Jukka Mäntylä;good;5;2019-03-20;4.79
Topi Kaaresoja;Great app! Easy to use. Works fine!;5;2019-03-14;4.79
Artūr Ruin;sumokejau 0,43€ uz 11min parkinga geltonojoje zonije, kur 30min kainuoja 0,30€;1;2019-03-13;4.79
Šarūnė Tilvikaitė;Don't know why or how, but the app is overcharging. Over the month, I have paid way way wayyyyyyy more than usually would. For 5min I paid 0.47 euro cents. It adds up to being a lot of money for nothing.;1;2019-03-10;4.79
Juho Inkinen;Works. Did not detect expired credit card though, but just gave email notifying failed transaction;4;2019-03-03;4.78
Teine Polaarsus;good af;5;2019-02-21;4.77
Margarita Pavlovic;overcharging;1;2019-02-20;4.77
A Google user;Best parking app!;5;2019-01-26;4.75
Rolph Muller;Used to be fine before update. Stopped using. Problems starting up and disconnecting. EDIT Seems to be fine now,,😊;5;2019-01-24;4.75
Jukka Hellén;Works great! I have been using this in Finland and Sweden.;5;2019-01-24;4.75
A Google user;riktig skräpapp. kräver hela ens livshistoria och ändå kan man inte ens betala en 48h parkering. hela deras Marketing avdelning borde avgå, kanske sköta kopiatorn eller nått;1;2019-01-18;4.66
Joakim GP;Useless app. Blocks on my mobiles unable to fetch location which blocks all other functions. Cannot be recommended. ... answer to reply. that doesnt work either. too late, app dropped.;1;2019-01-11;4.66
Avinash Kumar Singh;Download ParkMan App & Use Promo Code: CAR3 - you'll get 10 € free money for your first parking!;5;2019-01-03;4.65
Tim Sundqvist;Halvempi kuin Easypark sekä myös Suomalainen suosittelen! Ota tästä 10e parkkirahaa koodilla: PMAV;5;2018-11-27;4.534
Kim Nylund;It works and is easy to use.;5;2018-11-23;4.534
Phi Le;Easy for my life ever.;5;2018-11-16;4.533
Matias Lindroos;Amazing;5;2018-11-16;4.533
Tore Sode-Carlsen;Biggest issue is the fact that using this app mean parking is 50 percent more expensive compared to paying for parking in the conventional machine.;3;2018-10-25;4.531
A Google user;i have discount 10 e free parking but is not work when i park my car Cheating and deception is obvious;1;2018-10-23;4.11
A Google user;Works fine, use code XAQE to get free parking time.;4;2018-10-22;4.11
Badumka Duke;"Price in this app is higher than in vending machines of same parking. 
Ripoff app.";2;2018-08-19;
A Google user;Can't create an account. Really annoying.;1;2018-08-10;4.05
Pekka Viherma;Keeps crashing and is unusable;1;2018-08-07;4.05
Peter Lindström;Crashes - can't pay for parking!;1;2018-08-07;4.03
Egidijus;"Labai nepatogus app nes moki ne per tel abonementa o turi savo bankine 
kortele prijunkt";1;2018-07-29;
Ruslanas Paulauskas;"sms parkavimas pigesnis ir ne ka sudetingesnis. Lietuvoje si programele 
absoliuciai nereikalinga";1;2018-07-23;
Sven Lanens;After installing I cannot make an account!;1;2018-07-05;4.05
Marty van Doorninck;Settings menu impossible to access... icon activates core phone functions.;1;2018-06-30;
Suvi-Pauliina Peräsarka;Free parking promo code EKAC;4;2018-06-24;4.04
A Google user;"App itself works ok, but when it comes to service you may want have a look 
of different provider.";1;2018-06-19;4.04
Mattias Lundblad;Can't login to my account after I reinstalled the app on my new phone :(;1;2018-05-26;4.04
Nga Nguyen;Great tool! I have never know there is this great app to pay for my parking;5;2018-05-18;
Nga Nguyen;First use today work great as intended.;5;2018-05-18;
sushi violet;The best app to park my car in Helsinki, would never go back to easypark;5;2018-05-18;4.02
Morten Mark Juel;"Updated the app on my Hyuwei P9 today. Now the app starts, but stalls on 
""fetching location"". App has access to phone gps. GoogleMaps finds my 
location right away. Not possible to set my location manually, app stalls 
and says ""google play services are updating"" ...forever... Please fix ASAP.";3;2018-05-18;4.02
Kilonzo David;Any ideas on Huawei mobile. Shuts itself after opening;3;2018-05-17;3.51
Deakn Vishous;Got a huawei and the app started recently just crashing while starting up;2;2018-05-17;3.51
jengstro notarealsurname;Crashes on Honor 9;1;2018-05-16;3.51
Juha Liikanen;Koodilla UXFT ilmaista pysäköinti aikaa;5;2018-05-12;3.51
De Betong Media;The app keep shutting down for nothing;3;2018-05-11;3.51
GEORGE BARSAN;"Im not to glad because i also have to pay for paking even in days that are 
free(holy days).Over all an ok app but with minor minuses";3;2018-04-28;
Ali Asghar;It charges way more than what it says .;1;2018-04-03;3.51
Tuomas Ahola;Rahastusta;1;2018-04-02;3.51
Farhood Hosseinpour;The information update was unsuccessful.. it is not reliable app... it failed to update my info when I urgently needed to park ...;2;2018-03-14;3.51
Gediminas Jurgutis;Apgavikai! Nuskaito nuo kortelės daugiau, nei parodo aplikacija. Čia gi ne turgus!  Gėda:(;1;2018-03-06;3.50
Ais Man;Actually this is far the best parking app on the market. To get bonus of €10 of parking time, use this promo code KYPU on SignUp! So easy to use!;5;2018-02-15;3.51
A Google user;Works as intended!;5;2018-02-01;
A Google user;The best and easy app for parking. You can use this code ( SDKB ) and get 10€ FREE parking.;5;2018-01-04;3.50
Rasmus Schøler Sørensen;"Ringe UX design. Prøv følgende scenarie: Du har lige installeret app'en og skal parkere første gang. Du kommer til skærmen hvor du skal indtaste bilens nummerplade. Du står ikke ved bilen, men du har et billede af bil og nummerplade på din telefon. Så du skifter til din Photo app, noterer nummerpladen, og skifter tilbage til ParkMan. Men i stedet for at huske hvor den var, så starter ParkMan app'en nu helt forfra. App'en understøtter heller ikke Android multi-vindue funktion, så du kan heller ikke ""pinne"" fotoet af din nummerplade mens du indtaster i app'en. Det her er ikke avancerede funktioner, det er helt elementære ting som enhver Android udvikler møder i den første bog om Android udvikling.   Desuden: Ingen adresse på udvikleren i Play store.";2;2017-12-28;3.50
Olli Mustonen;Good but costs here in Denmark 3 kr + 10% so if you can live with that it's ok.;3;2017-12-07;3.50
Algirdas Zi;Lithuanian ZIP code not accepted;2;2017-10-20;3.46
Tomas E;Absurdas! Moki sąžiningai už parkavimą, o čia dar vietoj 0.30 € tau reikia sumokėti 0.30 € + 10% + 0.1€ = 0.43€ už tas pačias 30 min stovėjimo! Tai kodėl mokama ne iš rinkliavos administravimo dalies?;1;2017-10-16;3.46
Shehryar Ali;Its great and easy to use....for 10€ free parking use the code G55G;5;2017-09-30;3.46
Fred Cary;I got a ticket while using the app.  I've sent three emails to support and have yet to have one return message from them!   Update:.  I've changed the rating from one star to three after support finally reached me. While the app itself is great you are left to handle things on your own if you get a ticket while using it.  I'd rather just pay the meter than risk having to go through the hassle of a ticket.;3;2017-08-12;3.46
Andreas Warberg;I had a parking registration from 17.20 to 17.50. Was ticketed DKK 750 for observation period 17.29 to 17.39 clearly inside the valid period. The system doesn't work or parking attendants don't know how to use it.;2;2017-07-30;3.46
Sasha Mirpour;Easy to use but... parking said 11 SEK got charged 13 SEK even though I stopped it 15 min before time ended (rates including the percentage the app takes should be included from the beginning not added on later);2;2017-06-26;3.46
John Doe;Very bad implementation. Parking prices and zones are hardcoded inside the app. Unless you are absolutely certain that you have latest version, you may end up loosing your parking fee and receive a parking ticket.;1;2017-06-15;3.45
hannandor;"I did get an email regarding changing the payment plan from fixed to percentage, I did select ParkMan over other applications specially because the price was fixed. Can I still have the option to remain with the fixed price? Also I must say that the reason (improve short-term parking) that you use to advertise this price change is really lame. It's really obvious that whatever I ""save"" from short parkings I will give back much more when I do have long parkings. It's kind of obvious that this deal it's much more on your favor.";2;2017-06-11;3.45
Huntly Stuart;The costs involved in using this app have now become prohibitive;1;2017-06-01;
Ilir Kosova-Kakruki;It works fine;5;2017-05-31;3.45
Matti Suvanto;Functions well but the map colours are awfully difficult to read. White roads on a very light gray background equals headache.;3;2017-05-27;3.44
Orsolya Papp;Promo code BPY4 for 100kr free parking.;4;2017-05-19;3.44
Gmail Com;promo code XBB7 to get  10eur free balance. it really worked);4;2017-05-16;3.44
Chenyu Wei;You can get a free first parking for 10euros if you have a promotional code which is pretty handy. NTBU should work.;3;2017-05-14;3.44
René Steenstrup;Why can't I pay with real money, this is FUBAR...;1;2017-05-06;3.44
Marius Borze;Great parking app. Easy to use. Use promo code TSUD for one free parking max 10€;5;2017-04-18;3.43
Paul Gitau;Why would you charge me monthly standing fee even when rarely use application?;2;2017-04-05;3.20
Maunu Häkkinen;Great app. DQH4 for 10€;5;2017-04-04;3.40
Mohamed.H.M. Hassan;Use promo kode 1X82 and get 100 DKK free parking;5;2017-03-21;3.40
L P;Working;4;2017-03-21;3.40
Frank Russi;Works like charm 😊;5;2017-03-08;
Frederik Agner Husted;Nyeste promotionkode GT7Z - 100 Kr gratis parkering!;5;2017-03-06;3.33
A Google user;Free 10€ parking with code RMR2;4;2017-02-22;
Tapio Manninen;Parempi kuin Easypark! Tällä koodilla 10 € ilmaista pysäköintiä: 57J1Q;4;2017-02-14;3.27
Veera Kiminki;RQDK code for free parking.;4;2017-02-14;3.27
Mehdi Seif;Easy to use and working very fast. One of the useful app for parking.;5;2017-02-09;3.27
Freddy dsouza;A little room for improvement. Currently it is not possible to park by the hours. Min parking duration is 23hrs. This can be improved;4;2016-12-07;3.22
Kalpesh;After you download and install use code XC7W - You will get your first parking for free up to 10 €. I realised this free parking has an expiry date.;5;2016-10-26;3.22
Olga Maryasova;Promo code for free first parking: 3QRPQ.;5;2016-10-19;3.22
Petri Rauhamaa;Näppärä on. Koodilla MGRD saat 10 eur parkkitilillesi.;4;2016-10-17;3.22
Jarrad;V6MX code to get 10€ free parking, don't forget to order a sticker for your car;5;2016-10-09;3.22
Evren;It is simply too expensive to pay 50cents more per parking. I already park for short amounts and it doubles the amount I pay.;1;2016-09-30;
Chris Hjuler;PR3V;5;2016-09-20;3.22
Kalle Alanen;Useless;1;2016-09-03;
Faroq Salama;Very good thanks a lot;4;2016-09-02;3.22
Bie JH;Super let brugervenlig Parkerings app som virker langt bedre end f. eks Europark...                      Virker rigtig godt specielt i Kbh/Frb.         Ingen problemer med tilmelding (brugte selv Gmail og Visa Dankort) God feature m ledig p-plads virker.. Endelig en app der ikke suger alle info ud af ens mobil. Virker m nye det  betalings p system og man spare penge ...;5;2016-09-01;3.22
Tommi Rauhamäki;Erittäin hyvä ja helppo sovellus! Auttaa pitämään sakkolaput poissa ikkunasta. Kirjoita koodi 8PQ6 niin molemmat saa 10e parkkiaikaa, kiitos :);5;2016-09-01;3.22
Jarno J Laine;Extremely reliable and works just as it should. We've been using the business package for about a year and it truly works.;5;2016-08-29;3.22
Esko Haapaniemi;Käytä koodia 2Z4U, niin saat 10e alennuksen. Vaikuttaa parhaalta parkkisovellukselta varsinkin, kun hinnoittelu on kohdillaan.;5;2016-08-29;3.22
Tuomas Pakkanen;Helppokäyttöinen appi. Ei tarvitse enää kantaa mukana kolikoita. Tästä koodilla meille molemmille kymppi ilmaista parkkiaikaa! TC2GQ;5;2016-08-20;3.22
Hanna K;Use promo code AGBU to get 10€ parking time :);5;2016-08-15;3.22
Eero;Koodilla saa 10€ parkkiaikaa. Hyvä appi!;5;2016-08-11;3.22
Dmitrii Petrov;Promocode 3RXR for 10 eruro discount for first parking.;3;2016-08-06;3.22
Jan Kullberg;Promo code: JRWB, get 10e free parking credit! Great app, simple yet effective. Better than the competition in my experience.;5;2016-07-29;3.22
Ole Lindberg;Does the job, intuitively.;5;2016-07-08;3.22
Morten Morphus H.;Easy and simple , friendly use, no extra charge , recommended;5;2016-07-06;3.22
Mukesh Kumar;Promo code: ZEAD;5;2016-06-24;3.22
Audrius Sakalys;Use code SRAX for 10€ for the start! Good luck finding a parking spot :);5;2016-06-07;3.20
Carlos Worthington;Opel;5;2016-04-26;
Lasse Annola;Does what promises, useful! Free parking with code 2UCQ;5;2016-04-12;3.19
Ahmed Bonaparte;I love it. No panic anymore for annoying parking fines.;4;2016-03-22;3.19
Ulrik Christensen;Constant crashes. Totally useless.;1;2016-03-16;3.19
J M;Hyvä sovellus! Tähtiä vain 3 koska: parkkeerasin 24 tunniksi Lahdessa kirjaston eteen jossa vyöhyke 3 klo. 8-18. Sovellus veloittaa 24/7, myös yöajasta, joten vuorokauden parkkeeraus on vain seuraavaan päivään.;3;2016-03-09;3.19
Michael Lykke Hvam;"Love this app, but when I got a new phone, google suggest that I use my Gmail account to log on.. but since I did not remember my password for the parkman app I clicked ""forgot"" password, and Google was kind and suggested my email address, however, the account did not exist. After 10 minutes of confusion I typed in the email instead of letting Google put it in - and finally it worked.. quite annoying";1;2016-03-05;3.19
A Google user;Genial;5;2016-02-08;3.19
Patrik Svensson;Time and money saver!;5;2016-02-02;3.19
Samu Uusi-Heikkilä;Erinomainen sovellus. GPS vyöhyketunnistus rulettaa OK;5;2016-01-03;3.19
Joonas Palo;Toiminut täysin moitteetta jo Parkkinapista asti. Käteistä ei ole koskaan mukana, mutta parkman on aina.;5;2016-01-02;3.19
Vesa Seppänen;Helppo käyttää, näyttää myös lähialueen parkkihallit. Koodilla YZZ1 saa 10e parkkirahaa.;5;2015-12-08;3.16
A Google user;Tekee minkä lupaa ja toimii loistavasti. Liittyessä promokoodilla WCKPQ max. 10 EUR seuraavaan pysäköintiin.;5;2015-12-06;3.16
Erik Lindholm;This service is a good example of when business is driven by an idea of solving a problem and the customer pays with joy. Straight forward business without greed which I'm thankful for. Thank you!;5;2015-12-03;3.16
Jonne Kauristo;Ei tarvitse enää juosta edestakaisin parkkiautomaatille tai olla kolikoita autossa. Mahdollisuus vaihtaa eri rekisterinumeroiden välillä on erinomainen toiminto.;5;2015-11-27;3.16
Atte Lehtinen;Loistava. Kaikki toimii, ei valittamista.;5;2015-11-06;3.16
jarnomn;Helppo käyttää ja on toiminut joka kerta.;5;2015-11-02;3.16
Jani Nuutinen;Jätin auton kaivopuiston rantaan ja lähdin risteilylle. Sovellus toimi hienosti, mutta olisin kaivannut selkeämmin tietoa, että pitääkö sovellusta pitää matkan ajan päällä ja vaikuttaako maasta poistuminen toimintaan yms. Mutta hyvin toimi, mittari raksutti nätisti kännykässä taustalla. Yksi tähti pois koska sovellus peri parkkimaksua pidemmältä ajalta alueella, jossa maksullisuus loppuu klo 18, eikä klo 21 kuten sovelluksen tiedoissa.;4;2015-11-02;3.15
Amir Snapir;Works well so far. Sends the invoice for payments to your email.;5;2015-11-02;3.16
Jonatan Höglund;Works very well and intuitively, would be nice to see what the 'ending time' of a parking area is while hunting around with the app!;5;2015-10-02;3.15
Svante Suominen;5/5. En oo onnekseni pitkään aikaan nähnyt kolikoita.  Tää on mahtava sovellus!;5;2015-10-01;3.15
Esko Viranko;VQGZ;5;2015-09-04;3.14
Tero Helminen;Just great!;5;2015-09-01;3.14
A Google user;Jumalattoman kätevä softa ja toimii (lähes) kuin ajatus!;5;2015-09-01;3.14
Kåre Schmidt;Virker fint - nemt at bruge;5;2015-09-01;3.14
Milind Dumbare;Does not cost 4kr extra for small time parkings. Awesomeness!;5;2015-08-27;3.14
Teemu Honkanen;Käytä koodia PERS ja saat 10€ ilmasta parkkirahaa. Ohjelma on toimiva, mutta missään ei kerrota tarviiko Helsingissä autoon tarraa vai ei.;4;2015-08-22;3.13
Timo Varis;Harmittaa kun pitää maksaa jos tarran joutuu vaihtamaan. Kun käy töissä työmaalla, jossa menee vähintään 1-2 tuulilasia vaihtoon vuodessa... Muuten absoluuttisen mahtava sovellus. Edit: kas, nykyään pitääkin maksaa vain lähetyskulu. Paljon parempi.;5;2015-08-02;3.12
Boris Lumme;Ei hyväksynyt visa electronia vaikka muut internet palvelut hyväksyy;1;2015-07-31;3.12
Kalle Komulainen;Ei hyväksy mopon rekkaria;1;2015-07-25;3.12
Jesse Salmi;App is great but the 0,49€ service fee is too much. The service fee makes this app the last option for parking. Reduce the cost around 50% and I will only use this app for all my parking.;3;2015-07-02;3.1
Juha Saarinen;Easy to use and makes parking flexible and no more need to keep coins for parking.;4;2015-07-01;3.1
Tomi Häsä;Parkkipaikkojen löytäminen on hidasta. Animaatiot ovat ärsyttäviä.;2;2015-06-30;3.1
Anssi Saarela;But price per parking is too steep. If the price would be additional ~0.20€ instead of 0.49€ I guess way more people would use this. This is usually the last option for me after card or cash because of that. I have heard the same thing from many others who have not even signed because of that. My guess is that overall revenue would be higher with lower fee...;3;2015-06-25;3.1
Tomas Lindquist;Works well;4;2015-06-20;3.1
Rajeev Girdhar;Very slick and good app. Saves money, worries and hassle. Definitely needs clear colour coding and also, why not to take it next level by clearly stating that where parking is actually allowed or not?;4;2015-06-06;3.05
Bamce Fabricius;"Recommended. Easy to use and actually saves money as the cost is only for the real time used. No need to have coins, no need to add a little bit more coins ""just in case""...";5;2015-06-02;3.06
A Google user;If it would have on the map some color coding telling where is or not allowed to be used, it would be just perfect.;4;2015-06-02;3.06
Juha Lundan;Good app, helps a lot since one does not need to carry coins. Also brings savings since I pay only for the time I am parked. There are few areas in Tampere which Parkman does not cover, therefore four stars instead of five.;4;2015-05-02;3.05
Petri Käki;What is the fundamental change  that you all the sudden need the access to my files? Free parking spots?;2;2015-02-24;3.0
Jukka Hell;Saves money and makes parking a lot easier. You can use this code to gain 10€ free parking money: 4W8L;5;2015-02-19;3.0
Jouni Lohikoski;Why the new version suddenly wanted permission to my photos?;1;2015-02-07;3.0
Samuli Mansikkamäki;Todella kätevä korvike kolikoiden pyörittämiselle. Pysköintihistoria vs laskutushistoria helposti seurattavissa. Liittyessä antakaa koodi WQMS niin saatte 10€ ilmaista pysköintiaikaa.;5;2015-01-25;2.96
Ari Kurlin Niiniaho;Works well and easy to use. Code SE7H gives you 10 euros to use the first time!;5;2014-12-27;2.96
Jussi Alanärä;10€ parkkirahaa koodilla GTNB, use code GTNB and get 10€ free parking money;5;2014-12-14;2.96
Marko V;CEUN koodilla 10€ ilmaista parkkirahaa! Vähäpäästöinen auto ei ainakaan suoraan saanut -50% alennusta pysäköinnistä vaikka rakennusvirastosta tieto ParkManille piti mennä automaattisesti. Asian selvittely jatkuu.;3;2014-12-14;2.96
Tomi Hietala;Koodilla MTLE 10€ parkkirahaa.;5;2014-12-13;2.96
A Google user;Saat 10€ pysäköintiaikaa koodilla ENJE;4;2014-12-12;2.96
John Ranbo;How does the ticket woman know if i have payed or not without physical evidence, like reciepe?? Im not risking without an explane!!;1;2014-12-06;
Remi Bergmann;Download ParkMan app and use my promo code NGUXS - you'll get 10 € off your first parking!;4;2014-11-25;2.96
Harri Pesonen;Koodilla F3KM ilmaista parkkirahaa 10€.;5;2014-11-19;2.96
Sini K;Hyvin toimii Tampereella. Promokoodilla PT8EL saa kympillä parkkisaldoa;5;2014-11-12;2.95
Mika Markkanen;Easy to use, and saves serious money. Best of Android, clearly. I just noticed, upon parking my car in a strange city, that it should be easier to trace where I parked. I got confused for a while using this. Some sort of radar arrow to show direction, and distance to see, on map, would be nice to see. Think I use 3rd party parking radar app until then.;5;2014-11-06;2.95
Christian Møller;Den nye app er genial. I stedet for blot at vise den aktuelle timepris så laver den et overslag over den samlede pris på parkeringen. Den viser samtidig priser på omkringliggende parkeringspladser så man let kan finde den billigste. Enormt smart hvis prisen f.eks. skifter kl. 18 og man skal parkere henover sådan et takst-skift.;5;2014-10-31;2.95
Sami Nieminen;Koodilla S4VD 10 eurolla ilmaista pysäköintiaikaa.;3;2014-10-31;2.94
Eetu Luodemaa;FCQ7 koodilla 10€ ilmaista pysäköintiä;5;2014-10-28;2.94
Rasmus Viitala;Poor instructions on how to use the app..;1;2014-06-03;2.56
Daniel Persson;So easy worth the small extra charge to not have to look for change and locate the nearest parking meter!;5;2014-06-03;2.56
Sergei Borovskii;Sovelluksen konfigurointi sisätiloissa on mahdotonta. Esiin hyppää jatkuvasti ilmoitus ettei gepsin kautta pysty sijaintia määrittelemään, haluatko kokeilla wifia.;2;2014-05-07;2.55
A Google user;Notification bar ads. 'Nuff said. One star.;1;2014-04-29;2.55
Teppo Mustonen;Toimiva ja helppokäyttöinen.;5;2014-04-23;2.55
Mathias Lönnström;;5;2014-04-02;2.54
A Google user;Best possible software there is. One click parking. Have been using this software for almost a year now and it still wows me! This is an application that others should learn from!;5;2014-04-01;2.54
Tommi Saikkonen;Handles multiple cars;5;2014-03-06;2.52
