userName;content;rating;date;reviewVersion
Googlen käyttäjä;Lisätään kaupunkeja, ensimmäinen espoo! Sairaala alueilla on maksulliset paikat ja olisi hyvä että tämä toimisi näillä parkkiksilla kaupungista riippumatta.;5;2013-04-20;2.13
Jyri-Jussi Torvinen;Meinasi olla tuskaa vaihtaa tuo auto kunnes älysin että luo ensin uusi ja poista sitten vanha :D Muuten ei onkelma vaikkakin veloittaa palvelumaksun ilmaisillakin kaduilla joten ei kannata leikkiä...;5;2013-03-10;2.11
Tero Törmä;Ei anna luoda uutta tunnusta. Ei siis toimi;1;2013-02-26;2.101
Arto Pakanen;Jostain syystä ei anna tehä uutta käyttäjää;3;2013-02-25;2.101
Kai Virkki;Ajaa asiansa eikä ihan heti tule mieleen miten tästä saisi paremman.;5;2013-02-16;2.1
Heidi Lehessalo;Loistava;5;2013-01-19;
kari puumalainen;hyvä ja helppo :);5;2013-01-17;
Mehto Sika;Parkkinappi oli jo riittävän hyvä, mutta tämä onkin jo sitten loistava. Tuo luottokorttiveloitus on jees.;5;2013-01-16;2.01
Taisto Junkkari;Hyvä ohjelma!;5;2013-01-15;2.01
ygterhhdd;Muuten hyvä, mutta pari kertaa käynyt niin ettei appiin pääse sisälle kun pitäisi saada lisää parkkiaikaa! Testattu myös kavereiden puh. Ettei vika ollut omassa puhelimessa vaan tässä apissa! Heittää ulos kun yrittää sisään!;4;2018-08-08 06:20:13;3.44
Mono Senior;Miksi Parkman nykyisin paikantaa minut Keski-Afrikan länsirannikolle, paikannus on päällä ja gps toimii ainakin muissa appeissa? En ole muuttanut mitään ja käytössä on v 4.48 ja luuri iPhone SE (2030), jossa myös viim iOS. Aiemmin toimi hyvin. Tätä Afrikkaan sijoittelua on tapahtunut Tapiolassa, Eliel Parkissa Hgin rautatieasemalla ja nyt Länsisatamassa. Argh!;4;2021-08-29 12:30:44;4.48
Anonyymi Omena;Muuten loistava, mutta poistakaa tuo käynnistyksen yhteydessä pyörivä parkman logo. Hidastaa vain käyttöä, ei ole kovinkaan näyttävä eikä paranna brändiänne.;3;2017-07-22 13:27:55;3.26
guejshshh;The service is literally taking 50% commission. I just parked for one hour and paid 1,50€ when the automat indicates 1€/hour. I understand an additional charge for the service, but 50% extra charge is a clear rip off. I will go back to the old way.;1;2019-03-14 17:01:37;3.61
TwoDolphins;Pysäköinnin aloittaminen helppoa, mutta kestoon toivoisi ainakin 90minuutin vaihtoehtoa, ehkä muitakin. Myös pysäköinnin hinnasta toivoisi laskelmaa jo pysäköidessä. Muistutus pysäköinnin päättämisestä autolle palatessa GPS-paikannuksen perusteella ei käytännössä toimi. Myös se että pysäköinnin päättäminen vaatii kahta peräkkäistä painallusta ärsyttää: esim liukukytkin toimisi paremmin jos virhepainallukset halutaan välttää.;3;2019-01-28 16:48:12;3.56
Unohtaja;"Kätevä; pysäköinnin lopettaminen unohtuu helposti. Pitäisi olla mahdollisuus asentaa lopetusaika etukäteen";3;2019-01-26 00:53:17;3.56
lagge 48;"hej skrev idag ett email till er. er parkeringsavslutnings vakt/alarm fungerar firtfarande inte!!?? Blir idag debiterad 17,25 för en verklig parkering av en dryg timme då jag inte blev påmind om att stänga av. Värför fungerar inte er vakt???

Läs mitt epost brev till rr idag. mvh Claes Lagerstedt";1;2018-07-10 16:24:29;3.44
nikoharja;Sain sakot vaikka käytin tätä sovellusta;1;2019-02-19 11:30:17;3.59
4xEn;Miten siis saan ilmoitukset käyttöön?;3;2021-09-22 15:32:08;4.50
Tess The Diamond;Hienosti näyttää paikan minne pysäköidä - muistuttaa lopettaa pysäköinti. Helppo ja nopea - toimintavarma. Löytyy myös sähköauton Latauspisteen sisältäviä parkkipaikkoja - lisää toivotaan kehitykseen nopeita pikalatauspysäköintejä kaupunkiin - keskustoihin;4;2021-07-01 09:06:53;4.45
Artturi 2;Hyvin toimii!;5;2021-08-10 13:04:35;4.47
Angelus 47;En saanut muistutusta kun lähdin liikkeelle enkä edes silloin kun etukäteen lukittu aika päättyi. Kalliiksi tuli torilla käynti.;4;2021-06-23 11:56:44;4.45
rumakoira;Kätevä käyttää ympäri Helsinkiä!;4;2021-05-12 14:44:36;4.44
kusetettu fiilis;Jos ostat automaatista aikaa, laskutus katkeaa, kun maksuton pysäköinti alkaa. ParkMan vaan raksuttaa ja laskuttaa. Ei varmasti olis teknisesti mahdotonta katkaista. Poistin sovelluksen.;2;2021-06-17 15:09:19;4.45
paskaposti;Pitäisi itse päästä valitsemaan pysäköinti alue. Osuu varmemmin oikeaaseen parkki alueelle. Muyös tähänkin pitäisi saada koodit mille alueelle pysäköitt ( koskee yksityisiä alueita);1;2021-06-04 12:15:06;4.45
veonlyöä;Parkman toimii moitteetta. Kun vaan saisitte kehitettyä laitettanne niin että se aika ajoin muistuttaisi parkkeerauksesta. Jengi olisi vieläkin tyytyväisempi. Kiitos!;5;2021-05-19 08:46:15;4.44
aidanxyz;Feature request: would be awesome if the areas on the map were colored indicating where its allowed to park and where it’s not depending on time.;4;2021-02-27 17:22:30;4.38
biittikeisari;En saanut pysäköintiä lopetettua, sovellus ei päivittynyt.;1;2021-04-22 14:47:42;4.42
QDPR;Hyvä app.;5;2021-04-10 12:56:46;4.41
Bazzer!?!;Tekee minkä lupaa.;5;2021-03-31 08:56:22;4.41
bookalah;Life changing!;5;2021-02-02 13:40:19;4.37
kontiset;App ei lopettanut pysäköintiä vaikka painoin lopeta;2;2021-02-23 18:59:37;4.38
€45€;Ok;5;2021-01-14 10:35:44;4.34
Maadreha;Ihanat jouluvalot ja ilmainen parkki👍;5;2020-12-26 14:54:53;4.31
wolkkari;"Helppo pysäköintiohjelma. 
Suosittelen kaikille !";5;2020-11-03 14:15:49;4.25
llkxzyunvu;Yleensä ok, mutta tänään sovellus ei käynnistynyt, kun koetin lopettaa pysäköintiä. P ikoni vain pyöri ympyrää. Myöhemmin heräsi kysymään pysäköinnin jatkosta. Tunnin verran ylimääräistä maksua.;3;2020-11-18 19:29:48;4.26
kdkfjrjkr;Sovellus toimii hyvin, on luotettava ja erittäin kätevä 😊;5;2020-10-26 09:42:31;4.22
sarakrs;Jätti pulaan, eipä tullut vahvistusviestiä kenellekkään ja ei muuta ku käteistä etsimään.;1;2020-10-29 19:13:31;4.23
Tuulentupa;...parkkiongelma!;5;2020-09-29 12:22:30;4.19
Fu-Tourist;Laitan auton parkkiin vaikka 6 tunniksi ja ohjelma heittää pop-upin 30min välein, että onko auto vielä parkissa. Ja taas 30min välein ONKO AUTO PARKISSA jatkuen koko päivän ajan. Tämä hälytys tulee heti poistaa!;1;2020-10-08 06:19:51;4.21
ManoWarMan;Why is parkman pasting what’s on the clipboard. Feels like an intrucion of privacy!;2;2020-10-07 06:13:59;4.21
han-rik;Haluan pysäköidä nopeasti. Appi esiin. Ensin pitää kuitata paljonko maksoin edellisestä pysököinnistä joskus ajat sitten, ja sitten kuitata ”ei, en halua kutsua viittä kaveria”. Ja sitten voin aloittaa vasta pysäköintiprosessin. Amatöörimäistä käyttökokemuksen suunnittelua.;3;2020-10-05 07:48:23;4.19
monta kaupunkia parkkeerattu;Käyttö on ollut aina sujuvaa ja useamman auton lisääminen toimii kätevästi;5;2020-09-24 08:51:09;4.18
Tyytyväinen parkkeeraja;Olen ollut tosi tyytyväinen;5;2020-09-01 11:31:28;4.16
Madrid7Lee;kitos;5;2020-08-25 10:48:22;4.16
lumina tiinonen;Helpful;3;2020-08-29 14:07:44;4.16
koomikko1;Eivät osaa veloittaa korttia oikein, eikä asiakaspalvelu viitsi vastata puhelimeen.;1;2020-08-28 09:24:39;4.16
jörde;Toimii;5;2020-08-25 05:35:03;4.16
anttipanttix;Toimii varmasti ja on helppo käyttää.;5;2020-08-14 09:18:23;4.16
niiiiinuli;Veloitti tililtä kaikki rahat 5€ erinä!!;1;2020-08-22 03:01:51;4.16
no äh;Miten sen saa päälle ?;4;2020-07-14 10:03:43;4.15
PorvooParkman;Sovellus saattaa paikallistaa sinut väärin ja saat sen vuoksi parkkisakot koska maksat väärän pysäköintipaikan maksua. Itselleni kun kävi ensimmäisen kerran näin, sain pysäköinninvalvonnan edustajalta tiedon että tätä tapahtuu todella paljon! Valittaminen ei auta vaikka syy on teknisen virheen. Eli jos pysäköit Parkmanilla vieraassa kaupungissa, joudut silti nousemaan autosta ja etsimään parkkimittarin jotta löytäisit mikä on ko. pysäköintialueen oikea nimi varmistaaksesi onko sovellus oikeasti paikallistanut sinut oikeaan paikkaan. Ei kovin kätevää.;1;2020-08-03 06:10:31;4.15
Hernemies;Voisiko pysäköinti loppua automatic kun auto lähtee liikkeelle/ erkanee pysäköintipaikasta.;4;2020-06-23 13:37:47;4.13
dekssi;❤️❤️🌹🌹;5;2020-06-29 11:02:38;4.14
Strip fan;Sovelluksen provikan säästää nopeasti täsmäpysäköintiajalla. Kampanjakoodilla BCE7 saat 10 € ilmaista parkkirahaa.;5;2020-06-24 10:28:20;4.13
Jambe4566;Kolikkojen aikaan tuli laitettua ylimääräistä ”varmuuden vuoksi”. Veloitukset lähtevät kerran kuussa automaattisesti tililtä.;4;2020-01-25 13:08:20;3.87
AmeYama;Very easy to use. Helppoa ja nopea käyttää.;5;2020-06-21 15:34:06;4.13
kvupcycoyfdej;"Taaskaan sovellus ei ilmoittanut paluusta autolle.
VAihdan toiseen sovellukseen, kiitos tästä";1;2020-06-17 15:14:18;4.13
Bestiss;Tosi helppo käyttää ja lifesaver;5;2020-05-02 15:16:16;3.92
Emppu 👾;Aidosti arkea helpottava palvelu ja helppokäyttöinen sovellus. Hyvin huomioitu erilaisilla ominaisuuksilla mahdolliset kompastuskivet, esim. parkkiajan maksimiajan oletussäätö ja helppo parkkiajan lisäys sekä mahdollisuus pakottaa sovellus valitsemaan rekisterinumero erikseen, kun tallennettuna on useampi auto. Erityisplussat aivan erinomaisesta, nopeasta ja joustavasta asiakspalvelusta!;5;2020-04-08 11:18:53;3.92
jojonewcomb;"Parking fee reminder when back at the vehicle does not work. I have lost 70 e because of this crappy app this month alone!

Parking time adjustment in advance does not work either 

Everyone, use any other way to pay for your parking!";1;2020-03-11 15:51:01;3.89
pettynytpahasti;Muuten hyvä, mutta unohtuu aina päälle ja maksuja tulee ylimääräisenä aina näissä vaiheissa. Voisi oikeasti ilmoittaa silloin kun on lähtenyt liikenteeseen.;2;2020-02-20 17:39:09;3.88
SoleGagge;Kunnon varoitus ja herja tultava kun saapuu takaisin autolle!;2;2020-02-05 17:10:48;3.87
TOIKATTKU;Mahtava sovellus!!;5;2020-01-18 14:56:24;3.86
yritin;Käytän tätä mieluummin kuin EasyParkia. Jotenkin selkeämpi visuaalisesti.;5;2020-01-09 13:26:22;3.85
heavycruiser2;Ihanaa kun aina voi parkkeerata eikä huolta kolikoista!;5;2019-11-28 13:53:10;3.81
Lempiliittymä;Muuten ihan ok, mutta hinnoittelu on hieman epäselvä ja vaihtelua hinnoissa ilman loogista selitystä.;2;2020-01-08 12:08:06;3.85
niqqname;I use this app for parking once or twice a month, but it continuously tracks my location, using 47% of my battery. I get it that the app needs to know where I am when I’m actually parked, but all the time?;3;2020-01-01 12:56:45;3.85
Hghjhhjhgghjjjhjj;Hyvä hyvä;5;2019-11-22 13:34:55;3.81
Sanpola313;"Ohjelman tai ohjelman käyttäjän(?) sekoilun vuoksi nyt taas pikavoitto.
Tällä kertaa ei huomauttanut parkkiajan loppuessa että pitäis varmaa ottaa lisää parkkiaikaa. Sitä ennen kyllä sanoi vartin välein eli jatkuvasti että olet auton lähellä että lopetetaanko jo... autolle ehkä 50 metriä. Ja miten se Parkkipatekin osasi tulla sakottamaan juuri kun aika oli loppu. Meneeköhän Parkmanille liidipalkkio näistä?";1;2019-11-22 16:50:54;3.81
e-per-1;Voisiko auton liikkuminen katkaista pysäköinnin kun tahtoo unohtua, turhaa laskua;4;2019-09-28 06:44:53;3.76
believeme42;Hyvin rakennettu appi, hyvät perusominaisuudet;5;2019-11-12 15:24:56;3.80
IRR20%;Hyvin toimi;5;2019-10-21 11:08:02;3.77
jl_0000000000000;Otherwise fine, but background location services seem to consume a lot of battery. highest single app usage for me (11% of total battery consumption) despite I only park w Parkman few times per week.;3;2019-10-15 11:24:31;3.77
Markku JH;Olen käyttänyt Parkmania pian kaksi vuotta ja sanonpa että ei ole minkäänlaista häikkää ollut. Käyttö on helppoa ja sujuvaa, toiminta luotettavaa. Kaiken kukkuraksi tämä on suomalainen!;5;2019-10-07 15:01:55;3.76
Skibidi285;"Kokemusta sovelluksen käytöstä on jo useampi kerta ja voittaa parkkimittarin kanssa säätämisen 10-0. 
Kerran olin asiakaspalveluun yhteydessä oman virheeni vuoksi ja sain todella hyvää palvelua ja hyviä vinkkejä siihen, miten voin jatkossa välttää omat tyhmäilyt. Unohdin siis lopettaa parkin, kun lähdin liikkeelle.";5;2019-10-04 11:30:39;3.76
heitiiiii;Hyödyllinen pysäköidessä;5;2019-10-01 20:39:09;3.76
Edscu;Ihan hyvä, mutta rekisteröinti voisi mielestäni olla selkeämpää. Kun otin käyttöön uudessa puhelimessa, en edes tajunnut, että minulle oli luotu salasana automaattisesti, ja se piti kaivaa sähköpostista.;4;2019-09-02 11:41:31;3.73
kslsnsns;Hyvin toimii;5;2019-09-26 14:29:51;3.76
mmeevv;ParkMan sovelluksen pitäisi välillä muistuttaa pysäköinnistä. Harmittaa, kun se unohtuu niin helposti päälle ja maksaa liikaa.;1;2019-09-17 14:45:53;3.76
Epatsu;Todella laginen käyttökokemus. Piti käynnistää useamman kerran uudelleen, jotta pystyin etenemään pysäköinnissä. Alekoodista ei mitään hyötyä, koska se lähti rullaamaan heti iltakymmeneltä, vaikka pysäköintiaika alkaa vasta 8.00 aamulla.;2;2019-09-05 19:07:07;3.73
Replayapp100;Crashing, Doesn’t open the app;1;2019-09-04 11:11:31;3.73
Abir01;Makes parking easy and fast. Good application and gps reminder works well!;5;2019-09-04 10:52:36;3.73
Dtoncglå;Kartta saisi olla hiukan tarkempi sijainnin suhteen... ja parkkeerauksen osoite on hankala löytää kartasta. Esimerkiksi kaupungissa saattaa olla eri vyöhykkeiden ero yhden kadunkulman kohdalla ja ihan eri taksat...;4;2019-07-30 13:07:59;3.71
khdyjvdd;Hyvä;4;2019-06-11 12:20:49;3.68
Mikkovaan;Jos yrität appin kautta lähettää (Tuki, Lähetä sähköpostia) sähköpostia aspaan, appi kaatuu. Viestit-toiminnollakaan ei voi lähettää viestiä, koska viestikenttään ei voi kirjoittaa.;1;2019-07-03 06:08:18;3.69
Janne Koivulahti;"Pysäköinnin vahvistus on vähän turha tai turhan epäherkkä. 
Jäänyt muutaman kerran parkki pois päältä sen takia.";3;2019-06-19 09:29:20;3.68
sam875750;Use it instead of the old ticket machines all the time. 5/5;5;2019-06-11 13:26:26;3.68
Jussi P.;Kiva käyttää, mutta iso miinus tulee sovelluksen hitaasta ja sattuman varaisesta avautumisesta – minulla Parkman avautuu jos avautuakseen. Ne kerrat, kun saan sovelluksen auki, on se minuuttien odottelun tulos. Muuten ei valittamista.;2;2019-05-30 07:53:54;3.65
V...tuttaa;"En ole tyytyväinen, ei hälyttänyt auton läheisyydessä lopettamaan pysäköintiä. Saldo yli 40€.
Taidan lopettaa sovelluksen käytön...";1;2019-05-17 02:12:10;3.65
vittusaatanaonkotääkikäytös;Miksi veloitettiin hakametsän jäähallilla 5,85€ jos parkkimaksu pelin aikana on 5€???;4;2019-02-15 19:09:04;3.59
94847284842;Hyvä kätevä;5;2019-05-04 10:49:39;3.65
dderfxcgtyhvbjuiknmlo;Tähän menessä on ollut erinomainen 5-tähden sovellus, mutta nyt kun vaihdoin iPhoneen sovellus ei suostu avautumaan ollenkaan ja en pääse maksamaan pysäköintiä.;1;2019-05-01 13:48:15;3.63
Pikkuauto;Ios laite. Päivitän aina kaiken ajan tasalle. Nyt ParkMan ei avaudu ollenkaan. Tähän asti toiminut loistavasti, nyt siis ei tähtiä.;1;2019-04-29 09:16:52;3.63
Esapena;Jatkettaessa pysäköintiä sovellus ei näytä hintaa ja veloittaa enemmän kuin pysäköinti oikeasti maksaisi. Hinta näkyy vain erikseen tarkistamalla. Pysäköinnin hinnaksi tuli 24€ sijasta 26,75€.;1;2019-04-29 05:19:45;3.63
ScalyAtom;Nopea kattava toimiva iso apu jopa Helsingin keskustassa !!!!;5;2019-04-27 15:32:08;3.63
eki59;Toimii kuin junan vessa 😀👍;5;2019-04-26 10:04:41;3.63
zephyrsa;Pysäköin automaatin viereen, jossa Parkmanin tarra. Silti paikantaa autoni kauaksi tästä paikasta.;1;2019-04-24 08:42:41;3.63
lekalekalekaleka;Todella kätevä ja helppo käyttää. Suosittelen !;3;2019-04-23 09:16:25;3.63
parkmanlove;Todella selkeä ja helppokäyttöinen appi. Hinnat kohdillaan ja itselläni on toiminut aina hyvin. Pysäköinnin muistaa lopettaa siinä, missä muistaa laittaa turvavyön kiinni. Ihmiset jaksaa kaikesta aina valittaa ja sysätä kaiken vastuun muille. Kiitos kehittäjille! Täällä ainakin erittäin tyytyväinen käyttäjä!;5;2019-03-27 17:40:19;3.61
Brewsteri99;Pysäköinti vain jatkuu ja jatkuu vaikka sen aiemmin lopetin, veloitusta puoli tuntia ylimääräistä;2;2019-03-16 14:02:40;3.61
levuuuuuu;Sovellus ei auennut, niin jouduin maksamaan turhaan kahdesta tunnista, kun en saanut sovellus auki ja pysäköintiä päätettyä.;1;2019-03-07 15:38:58;3.61
Moppe;Elämää helpottava teknologinen ihme!;5;2019-02-26 09:36:32;3.60
anissakk;Huippu ohjelma!;5;2019-02-22 07:55:12;3.59
mahnala80;Tää on vaan niin pätevä sovellus , toimii hyvin. Ja asikaspalvelukin , auttoi loistavasti kun soittelin.;4;2019-01-04 16:59:37;3.54
Dellababe;Very very useful;5;2019-02-13 10:36:18;3.59
Timbe1;Huikee appi, helpottaa elämää.;5;2019-01-23 07:34:37;3.55
Hiisimies;Aina toiminut moitteetta.;5;2018-12-10 12:24:21;3.52
Vallabi;Aivan loistavan helppo ottaa käyttöön.kampanjakoodi 5HBD;5;2018-12-06 17:39:04;3.52
Maku73;Ja hyvä;5;2018-10-24 18:24:05;3.50
Jaska L;Toimii kuten pitää!;4;2018-09-28 07:41:19;3.47
Rmj79;Tosi helppo ja nopea tapa hoitaa parkkimaksut oli sitten Helsingissä tai Oulussa!;5;2018-10-18 12:31:14;3.47
samuleisson;Näppärä sovellus;5;2018-10-16 13:16:05;3.47
Jenskyli;Helppo, toimii. Parkkeerauksen pelastus.;5;2018-10-05 09:16:26;3.47
emskuliini143;Helppo käyttää;5;2018-10-04 11:21:22;3.47
J76L;Toimii loistavasti.;4;2018-08-29 13:28:04;3.46
NoTCSR;Autolle palatessa Parkman ei tähän päivään ole koskaan osannut muistuttaa pysäköinnin lopettamisesta.;1;2018-09-11 10:07:59;3.47
tihgu;Helppo käyttää kiireessä;4;2018-08-21 10:45:10;3.46
hjkgfruiojcfsrthjkkvvh;Veloitusperuste puuttui alueelta. Ei merkkejä, ei hintoja;2;2018-08-28 14:51:20;3.46
Roosamimoosa;Toimii myös ulkomailla.;5;2018-08-28 09:29:36;3.46
chelelektu;Loistoappi👍;5;2018-08-27 12:06:21;3.46
To_Ok;Olen käyttänyt sovellusta n. 6kk pääkaupunkiseudulla eikä ole tähän mennessö löytynyt valittamista. Kyllä tämä aina parkkimittarit voittaa :);5;2018-08-22 05:40:43;3.46
tiipataapa1227;Hyvä ja toimii;4;2018-08-02 17:22:12;3.44
Tukkke;ParMan make the travelling easy. Park almost anywhere, no coins no searching for parking machine!;5;2018-08-18 10:40:36;3.46
Isoaso;Entisenä Comet-mittarin käyttäjänä harmittelin, kun kyseinen palvelu loppui. En harmittele enää, sillä Parkman toimii vielä paremmin ja on yksinkertainen käyttää.;5;2018-08-17 11:09:27;3.45
Autoilijatar;I can recommend👍🏼;5;2018-08-08 13:44:06;3.44
Katsku 66;Ihanan helppo;4;2018-07-09 12:00:03;3.44
Tupchen;Aikaa ja rahaa säästävä välttämätön äppi!;5;2018-07-30 14:42:46;3.44
LanaLeon4444;I only park using this now😊;5;2018-07-24 17:38:17;3.44
MattiLammikko;Salasanan vaihto kestää niin tuskaisen kauan että ihan pelkästään siitä hyvästä 1 tähti. Sama juttu nyt molemmilla kerroilla kun oon joutunut sen tekemään.;1;2018-07-19 10:55:36;3.44
Tomppa_19;Kätevä, helpoo käyttää. Helpottaa esim lasten kanssa asiointia kylillä kun jää turha jonottaminen edes yhdestä paikasta pois.;4;2018-05-31 06:18:31;3.43
Jarmo *1960;Toimii;5;2018-07-08 07:08:26;3.44
valtionvarainministerix;ParkMan unohtuu turhan helposti päälle, mittari raksuttaa vaikka on poistunut ajat sitten paikalta. Hälytysominaisuus tarpeen.;3;2018-06-30 09:50:03;3.44
elmerilla;Erittäin helppo käyttää!;5;2018-06-27 07:26:05;3.44
jolknggdfgszZxcddd;Huippusysteemi👍;5;2018-06-20 04:57:50;3.44
K@rtsa;"Pari kertaa nyt kokeillut tätä sovellusta, käyttö helppoa ja vaivatonta toimii loistavasti, miksi en anna 5 tähteä johtuu siitä ettei voi määrittää parkkiveloitusta pankki kortin debit puolta menee aina credit puolelta, pankki kuitenkin ottaa näistäkin veloituksista omansa. Muuten loistava ohjelma!
Edit: Omaa tyhmyyttään en osannut laittaa yhdistelmä pankkikortin debit puolta veloituspuoleksi. En ole edes tiennyt että missä se debit puolen nro sarja on😮, nyt tiedän!!! Kiitos. Loistava ohjelma ja viisi tähteä siitä";5;2018-06-17 06:56:12;3.44
Helinä0506;Suosittelen. Helppo käyttää.;5;2018-06-08 11:49:26;3.43
santtupee;Tosi helppoa ja vaivatonta. Toimii hyvin!;5;2018-06-08 07:27:07;3.43
Tab1604;Excellent and friendly user. Recommended;5;2018-06-01 13:28:15;3.43
Olppu;Erinomainen palvelu, mutta useamman auton keskinäinen valinta ei oikein toimi...;4;2018-05-13 10:41:36;3.41
henrimikael;Works.;5;2018-05-22 13:53:04;3.42
möttöne;Ainoastaan pysäköintiajoissa on vähän ongelmia, kun lukee max tunti vaikka parkkimittarista sais enemmänki;4;2018-03-17 06:11:03;3.41
Mansenmies;Vielä kun voisi Tampereella maksaa pysäköintihallissa, niin olisi täydellinen.;5;2018-05-08 07:54:16;3.41
Lauttasaari lady;Very easy and practical parking in Helsinki. Totally enjoy using this application.;5;2018-05-01 19:14:15;3.41
Arttures;Toiminnassa ei ole ollut ongelmia;5;2018-04-28 10:36:35;3.41
Bubba 717;Suosittelen;5;2018-04-20 08:52:59;3.41
Stefan HR;Saves me and the company big pennies! Easy to use, good service!;5;2018-04-18 12:34:56;3.41
omena ukko;Helppo ja hyvä appi;5;2018-03-17 09:52:21;3.41
wutaodehai;I just switched to Finland App Store, this app turns to in Finish, where I can set back to English?;3;2018-02-14 19:12:36;3.40
Reissu-Lasse;Poistakaa kartalta nuo alueet, joilla äppi ei toimi. Sekavoittaa käyttöä;2;2018-02-22 06:03:43;3.41
juujuujuu apple watch;Haluaisin käyttää apple watchin/ sirin kautta. Koska mahdollista?;4;2017-12-30 20:15:15;3.33
Antonwork;Supers smidigt;5;2018-02-07 11:20:05;3.33
Olli-boy;Olin myöhässä kokouksesta. Löysin sattumalta parkkipaikan aivan vierestä kadulta. Juoksin kokoukseen. Juostessa avasin sovelluksen ja napsautin parkkeerauksen päälle.  15 min sijasta myöhästyin vain 5 min, koska ei tarvinnut mennä etäänpänä olevaan parkkitaloon.;5;2018-02-06 09:38:29;3.33
Tsökködööröö;Toimiva ja kattavalta vaikuttaa, olen oikein tyytyväinen.;5;2018-01-05 13:47:36;3.33
spheroid;Voittaa perinteisen pysäköinnin 100-0 ja tuntuu olevan paras näistä tämänhetkisistä vaihtoehdoista. Suosittelen!;4;2017-11-13 22:19:13;3.30
Kim Mo;Laitoin ”Muistuta autolla” toiminnon päälle pysäköityessä. Eipä muistuttanut, tunti ylim. aikaa tuli maksettua.;5;2017-12-22 18:48:10;3.33
Ville iPad;"App tehty vähän huonolla UI suunnittelulla. Viimeisimmässä päivityksessä piti tulla valinta auton valintaan ennen pysäköintiä - en löytänyt toimintoa.

Muokkaus: ohjeen avulla löytyi. Kai nuo voisi ohjelman perusasetuksiin laittaa?";3;2017-12-19 06:39:35;3.33
Fronsu;Parkkimittari jää toisinaan epähuomiossa päälle, pysäköinnin jo päätyttyä. Kenties autolle saavuttua voisi muistutus-signaali olla voimallisempi? Muuten hyvä applikaatio.;3;2017-12-15 15:46:15;3.31
HenriMatias;"Optimointi iPhone X:lle olisi tervetullutta, melkein kaikki muutkin apit ovat jo päivittyneet, miksi ei teidän?!

Muuten erinomainen appi, helppo ja nopea käyttää sekä vapauttaa kolikoista ja parkkimittarien etsimisestä!";5;2017-12-03 00:51:46;3.31
Temone;Ios 11.1.2 on appi kaatunut kahdesti;3;2017-11-18 20:54:53;3.30
Matkasaarnaaja;Siis niin todella yksinkertainen palvelu kuin olla voi! Sekä käyttöönotto että käyttäminen pysäköintitilanteessa molemmat. Ehdottomasti paras tapa hoitaa parkkimaksut.;5;2017-10-27 20:23:22;3.27
FinnShermy;Toimii kyllä mutta ei tuo nyt varsinaisesti iPhone X:ää tue näytön osalta. Boxina pyörii.;3;2017-11-10 17:43:08;3.27
portfellow;Todella helppo ja yksinkertainen tapa maksaa pysäköinti;5;2017-09-26 11:58:45;3.26
Autoileva kansalainen;Valittaa että ei ole internet-yhteyttä vaikka se on päällä.Toimii ainoastaan Wi-Fi yhteydellä joten toivoisin että sovelluksesta korjattaisiin tämä ongelma pikaisesti,koska muuten tälle ei ole käyttöä;2;2017-10-14 12:04:47;3.27
ainamatilda;Toimii hyvin , helppo käyttää 👍🏻👍🏻👍🏻;5;2017-09-20 09:08:54;3.26
OOIIOOIIOOIIOOIIOO;"Ei tarjolla mahdollisuutta saada parkman päättämään pysäköinnin automaattisesti kun auto lähtee parkista... voisi antaa käyttäjälle mahdollisuuden ottaa tämä käyttöön?

Ylimääräistä pysäköintiaikaa kertyy usein kun pysäköinnin manuaalinen päättäminen unohtuu... 

Onko parkmanilla ja pysäköintipaikkojen haltijoilla halua tarjota tämä ominaisuus?";1;2017-09-21 09:33:33;3.26
märq;Helpottaa paljon, ei tarvitse miettiä mittareita. Hyvä ja toimiva sovellus!😊;5;2017-09-07 09:53:55;3.26
kakkahaisee;Kakka palvelu, ottaa välistä, verottajan pikkuveli;1;2017-09-07 16:49:03;3.26
hkorja;Ok.;5;2017-08-26 11:16:41;3.26
Kalevi Lehtonen;Samanlainen kuin easypark, mutta paskempi.;3;2017-09-01 11:34:55;3.26
Zelda Kukkonen;+++;4;2018-05-11 11:24:37;3.41
Marliisa;Kyllä on helppo pysäköidä, kun puhelimessa on Parkman. Ei tarvitse kolikoiden kanssa sählätä. Körevä!;5;2017-08-17 17:57:04;3.26
Orvokki;Valitettavasti Parkman ei toimi Vantaalla vieläkään kovin kattavasti.;3;2017-08-12 08:10:18;3.26
grey oono;Ei lataudu;1;2017-07-29 12:47:49;3.26
Reiska78;Helpottaa pysäköintiä, kun ei tarvitse kanniskella kolikoita mukana eikä miettiä pysäköintiaikaa etukäteen.;5;2017-07-24 19:26:44;3.26
Annikki35;Helppo ja hyvä;5;2017-07-18 07:46:10;3.26
Orpula;Asioin aiemmin vain paikoissa joissa oli ilmainen parkki tai korttimaksu, ahdisti kun ei ollut kolikoita, nyt voin käydä missä vain, aivan loistava keksintö ja toimivuus!;5;2017-07-10 15:27:39;3.26
Nopea asennus;Toimiva juttu;5;2017-07-06 11:26:40;3.26
pitkae;:(;3;2021-08-25 09:35:29;4.48
hejco;JYPS48;1;2020-06-01 18:37:43;4.13
Serial Parker;Nice, simple app that delivers big. Easy step by step intro was reassuring, and smooth user experience. Beats having to scramble for change. What happens if my phone runs out if battery while the meter is running?;4;2013-03-28 13:48:36;2.05
MaxxBass;No problems with the app.;4;2017-09-23 16:00:27;3.26
