userName;content;rating;date;reviewVersion
proud boys;"These guys open their heads as soon as the order comes, ""Do you want fines""? etc. if the new app is not loaded.";;;
1;2013-02-17 15:03:51;2.04;;
Ottto12345;Absolutely great service;5;2013-01-27 12:45:15;2.02
Kahvaliini;Yes, I don't put card information in an app like this. Automatic charges are questionable and unreliable.;1;2013-01-28 16:59:08;2.02
lunatek;According to Tampere, I say too.;5;2013-01-15 23:36:38;2.01
TerhoT;Otherwise, it's definitely ok, but I won't start postponing the visa number for every little api. Make the app a prepaid opportunity so four stars bump more.;1;2013-01-19 13:16:48;2.01
Mielisholm;A very well-functioning app with good customer service.;5;2013-01-14 19:29:04;2.01
Tået;Works as it should!;5;2013-01-14 19:29:00;2.01
Tyytyväinen asiakas;I had to immediately comment that there were great reforms! Now you can find a car on the street if I happen to forget where I parked! Even when you get ParkMan to Tampere too ...;5;2013-01-14 19:05:15;2.01
Saffe&Bo;Works well. Plus another good map :);5;2013-01-14 18:34:40;2.01
a.i.k.;The service is great.;;;
1;2013-03-15 14:54:31;2.04;;
Davo Mor;did not get trough the sms verification - sms could not be sent...;1;2021-09-27;5.37
Mika Pirhonen;Easy and cheap parking most locations on Finland 🇫🇮. Most cities use this and private parking spot. Europark AutoPay locations you can use Parkman, license plate regonition is key. Also some AimoPark & Pasilan Pysäköinti, Port of Helsinki locations. Start parking on app when parked, just check you are right area. Payment works with Visa / Mastercard card, collecting happens next month 1.st day. Pay just time you need, and extend if you need. ... Free voucher code to app: P8HJ & FJB2;5;2021-09-20;5.37
Greggorio Zzyzx;Im traveling through all of the EU but it will not work just because I have a Portuguese phone #? So f'n lame;1;2021-09-19;5.37
George Sapkin;Kind of works. Max parking time is hit and miss for certain spots.;3;2021-09-17;5.36
Aston;Much prefer this to Europark.;5;2021-09-17;5.37
Mattias Andersson;When you decide to park, they change the parking fee + their profit, so for instance I park for 1 hour and the parking fee was 4 Euro, they charge 4.50 euro. That is okay. But then if you take a moment (seconds) to decide, then they increase their fee, to make you feel stressed to park. So suddenly the parking + fee was 4.65 euro and as I thought, shall I pay for 1 or 2 hours? Their fee increased over time. So when I paid, they wanted 4.75 euro. For me this is annoying. Take another app.;2;2021-09-04;nan
Jaakko Ronkainen;Speeds up parking and removes a lot of quesswork;5;2021-08-23;5.36
Jonathan Bouvette;Don't work. None of my email are recognized. They are just 20years old email. I don't recommend;1;2021-08-21;5.36
Biris Ciprian;I wish you could park two cars at the same time, on the same account. My wife and I use the same account and have both cars registered. If one of us parks one car, we cannot park the 2nd.;5;2021-08-16;5.36
Timo Rantalaiho;Confirming mobile phone number did not work. Otherwise, a great app!;3;2021-08-15;5.36
Anthony P;Does not currently work in your country. I am sitting in Tallinn, another app not working for non-Estonian mobiles?;1;2021-08-13;5.35
Vikram Singh;Not able to login;2;2021-08-05;5.35
Antti Leinonen;Easy to use and works perfectly.;5;2021-08-05;5.35
Remigijus E.;This app give you 5€ with code, but at end of month try charge ~2 € from card. This app offering at weekend(free parking time) park and pay €.;1;2021-08-01;5.35
Nadir Bengana;They lied, the machine said use a code for free parking for new users. Low and behold they charged me anyway. I am writing a complaint to kkv for lying. Do not use this app.;1;2021-07-25;5.35
Lmhafu;High fees. But convenient;4;2021-07-21;5.34
Mindaugas Būdas;Registration flow is weird;1;2021-07-17;5.35
Andrei Antanovich;Cannot register. Pops up with the dialog to accept legal terms. When I click Accept, it ask me again (infinite loop);1;2021-07-12;5.34
Nea Peltoniemi;Cannot get in to use the app, because it won't register my acceptance of the legal terms. Every time I click 'Accept' the pop-up bounces right back up.;1;2021-07-05;5.32
Bernardas Saknys;Update: custommer support finally reached me. We figured that I paid for ship parking instead of a car, that's why I got fined :) My problem was settled very professionally.;4;2021-06-19;5.32
Kristupas Kovas;The app froze and did not let me end my parking. As well as that, their support team did not even care to pick up my calls and I was left to tackle this parking problem by myself;1;2021-06-03;5.32
Vilhelm Milis;Good app that's easy to use, but is missing one feature that would make it great, it should show nearby parking spaces and the prices next to them, because how it is now, you only know the price of parking once you are in the parking lot and you have to find a parking space by yourself, instead of choosing one from the app. Another feature would be nice of being able to schedule parking to start at a later time for parking spots that have set times that you need to pay for.;3;2021-06-03;5.31
Veronica Woolf;Says it doesn't work in UK! Uninstalled.;1;2021-05-22;5.31
Jaymwa Masase;its easy to use nd works for me;5;2021-05-06;5.30
Lukas Narmontas;Helpful app for parking;5;2021-04-29;5.30
T Kenz;ideally it gives back the money for unused minutes, it doesn't at the moment. but overall a good app;5;2021-03-17;5.28
Mikko Vänninen;I've had no problems with the app;5;2021-03-11;5.28
Varaloba One;Never missed a beat since started using a few years ago! Worked perfectly first time out, don't forget to complete profile, payments and vehicle registration, as they are all needed. Used when travelling from Helsinki to Tallinn and leaving the car in the long term park, also worked in my local Finnish town. Even though ParkMan takes 10% plus 35 cents, I think this will be saved by only paying for the exact time parked, rather than having to add a safety margin - well done! Certainly cannot understand the negative comments, perhaps some people just do not understand how to set it up!;5;2021-02-02;5.26
Miikka Vanhamaa;Buggy as hell on android.;1;2020-12-29;nan
Ville Nurmi;Makes parking easy;5;2020-12-28;5.16
Joel Korhonen;Works well for me. I have used this for some years in Helsinki.;5;2020-12-23;5.16
Rasmus;"Can't register because ""phone number is not verified""";1;2020-11-30;nan
Dennis Rye Grubbeholm;"The app does not stop parking when you press ""stop parking"".";1;2020-10-08;5.07
Arturas Ryzovas;perfect;5;2020-09-24;5.06
Marijus Sabonaitis;Best parking app;5;2020-09-04;5.06
S V;Doen't allow to use foreign mobile numbers to register and pay for parking in Estonia europark;1;2020-09-04;5.06
Khankhan Janjan;No recommended. Dont used this App I parked in fredriksberg Alle but this App registed me on København ø blå zone. I got a fine I use EasyPark that is a good app;1;2020-08-21;nan
Google User;For free parking worth 10€, use this promo-code: SGPC 10€ edestä ilmaista parkkiaikaa saat käyttämällä koodia SGPC Nice app. Beats hands down the easypark-app that sniffs all your personal information like contacts, your pictures etc. Please add an an alarm-function when the parking ends!!! Why can't I just choose 15mim parking as earlier? Now I have to add an ending time which again wastes my time.;3;2020-08-17;5.06
Joonas Hämäläinen;There are some bugs in payment screens. App also updates/saves card information in some cases without notifying user about it, in such cases where it definitely shouldn't. Could lead into nasty surprises for some users.;1;2020-08-07;5.06
Hannu Siikonen;"Pricing should match with the ""manual"" prices to improve my rating.";3;2020-07-31;5.06
Tero Virtala;So far, it has worked flawlessly.;5;2020-07-31;5.06
Vygintas Kirda;Scam software stealing money. You pay 5 times more than in physical pay aparatus. SCAM.;1;2020-07-30;5.06
Steven Flostrand;Does not work with most foreign phones. Very annoying when parking lots do not have machines to pay!;1;2020-07-28;nan
Kevin Rustill;Convenient app, but more expensive than the ticket machines. It is useful if you need to extend your time, as saves having to go back to the car to buy a new ticket. But you pay more for the service. eg: Linnanmäki amusement park in Helsinki is 3e per hour. With app it is 3.65e for 1 hour (+65c) or 6.95e (+95c) for 2 hours and 10,20e for 3 hours (+1,20e). I thought this would get me better prices, not worse ones!;3;2020-07-26;5.06
Charlie Harper;Terrible;1;2020-07-18;5.06
Deiv Salutskij;Easy to use;5;2020-07-15;5.06
Kati Kuusinen;"After verifying my phone number, I get an error message saying ""ParkMan does not currently work in this country"". And I can't use ParkMan. I'm in Finland and Parkman definitely is here.";1;2020-06-15;5.05
Commander Spock;why exactly it's s trying to get my location in background?;1;2020-05-01;5.03
Crying Loud;After a whole day of struggling wit it to make it work, it finally does. I Gave it 1 star before. But it was a day of struggle when I received verification codes, punched them in and got a message they are invalid. I have 17 codes in total. Come on!;3;2020-04-29;5.03
Jorge Avalos Salguero;It's OK, does the job intended, but for some reason I keep having to press buttons more than once for them to take effect. It also immediately notifies me that I'm close to my car and wonders if I'm leaving when I set the parking. I just set it, of course I'm close to the car… keeps asking to improve location despite full GPS tracking is on on the phone. Needs polishing details before the app is properly good.;3;2020-04-21;5.02
Jonathan Rhodes;Awe of a fluent English 4ee3ees;5;2020-03-22;nan
En Kerro;Terrible and sketchy app, avoid at all cost! Requires you to attach credit card even if you have promo code. Very shady, makes me wonder what they use it for? Do they sell it? It also does not accept valid promo codes, and does not accept valid licence plates. Just terrible.;1;2020-01-06;4.94
Oliver Jacoby;Bad app, lousy customer service;1;2019-12-13;4.92
Esa Kukkonen;Very convenient, but a 2h parking coin would have been a third cheaper.;3;2019-12-08;4.92
Martin Pedersen;"I have twice experienced that the ParkMan app registers my parking for a different location than the one I have chosen. The moment I press ""Park here"" and the parking starts, the location moves. The first time I experienced this error, I discovered the error immediately because the location was suddenly somewhere else in the city than where I was standing. The second time this happened it was just on the other side of the same road, I therefore did not discover it, and got a charge. ParkMan does not see this as their responsibility.";1;2019-11-02;4.89
Usman Burki;Does the job brilliantly. Been using a number of years now and never disappointed. Thanks for a wonderful experience.;5;2019-10-31;4.89
Ola Sjögren;The parking on Skøjtevej on Amager is not visible in your app. Very annoying!;1;2019-10-26;4.89
Antonio Martinelli;This app is designed to get you a fine. Look instead for a manual payment by the parking lot. VERY bad experience with the app. I don't understand how Helsingør kommunen give them permission to operate.;1;2019-10-23;4.88
Margus Heilä;Works well. Finds me even the other app does not.;5;2019-10-19;4.88
Michal Brutvan;Great app, makes parking very easy. However, after I got a new phone and installed Parkman on it, I did not realize I had two cars in it after logging in, and the app did not ask me which car I'd like to park with. It somehow determined the car automatically, which was incidentally not the car I parked with. So on top of my 20 euro parking bill, I ended up with an 80 euro fine too. I'd say that's a very expensive UX issue.;4;2019-10-08;4.87
Waqar Altaf;This Is good app. But I dont know I have free parking but still company charge me parking fee. Thats really bad.;4;2019-09-17;4.85
Adrian Esanu;Small in size, intuitive, no ads and fast working. If you want to get the first parking for free, enter the following code after installation VXFU;5;2019-09-04;4.86
Petteri Bergius;Works great;5;2019-08-29;4.85
Pomor Ko;Pretty negative. I have Russian mobile number. Today came to Klaipeda and installed this app. It has rejected to work saying that its not working in my country meaning Russia. Location permit granted to this app.;1;2019-08-06;4.84
Narvydas;Get free 5$ for parking with my code LNRTZQ;4;2019-07-01;4.82
Denis Druqu;very good;5;2019-07-01;4.82
Svetlana Kicenko;Good!!! Tnx;5;2019-06-21;nan
P WS;The best parking app, hands down. Anyone who complains about the price has not used other forms of payment...;5;2019-06-10;4.82
Hai Bui;Best parking app right now!;5;2019-05-31;4.8
lmuszyns;Very convenient and i always find a place to park!;5;2019-05-30;4.8
Alex Inkiläinen;Great but charges are pretty high.;4;2019-05-24;4.8
Santtu Vuori;If the location is not used by the app then why do payment cards and registered cars not appear. Rookie mistake me;1;2019-05-21;4.8
Kimmo Kinnunen;Works flawlessly;4;2019-05-13;4.8
Pete;Works very well, BUT (and this is a big one) charges you if you are parking during a time that the parking is free!!!;3;2019-05-01;4.8
Juha E;Car license number should be better shown if many vehicles. Wrong one easily selected.;4;2019-04-26;4.8
Eleonik 76;Horrible app. I have parked near Pasila using the app, with countdown on, and when my job was done, came back, stopped, the amount was about 6 eu, paid and go on. After a week I receive email, which claims, that I haven't paid. Right away called ParkMan, and the answer was simple. They were not charging at the same time, but once a month! Seriously?! How about if I use 20 parking, and each 10 eu? So have to pay at once 200 eu end of month?! Thiefs and crooks. Uninstall!!!!!;1;2019-04-25;4.8
Asus Prime;The app is working well. Free 10 € parking for you with code: LEB6. Just a working help. € 10 free parking for you with code: LEB6;4;2019-04-15;4.79
bykavka;(edited after initial slow response to support requests - was adderesed and solved). Good app for parking while travelling. Parking in Tallinn always gave me nightmares but ParkMan solves that beautifully. Probably won't use in home city as surcharge for short parkings is a bit too much. Other than that highly recommended.;4;2019-04-12;4.79
Sebastian Bergman;After you download and install use code LQQG - You will get your first parking for free up to 10 €. After installation, use the code LQQG to get a free parking time;5;2019-03-28;4.79
Jukka Mäntylä;good;5;2019-03-20;4.79
Topi Kaaresoja;Great app! Easy to use. Works fine!;5;2019-03-14;4.79
Artūr Ruin;I paid 0.43 € for 11min parking in the yellow zone, where 30min costs 0.30 €;1;2019-03-13;4.79
Šarūnė Tilvikaitė;Don't know why or how, but the app is overcharging. Over the month, I have paid way way wayyyyyyy more than usually would. For 5min I paid 0.47 euro cents. It adds up to being a lot of money for nothing.;1;2019-03-10;4.79
Juho Inkinen;Works. Did not detect expired credit card though, but just gave email notifying failed transaction;4;2019-03-03;4.78
Teine Polaarsus;good af;5;2019-02-21;4.77
Margarita Pavlovic;overcharging;1;2019-02-20;4.77
A Google user;Best parking app!;5;2019-01-26;4.75
Rolph Muller;Used to be fine before update. Stopped using. Problems starting up and disconnecting. EDIT Seems to be fine now,,😊;5;2019-01-24;4.75
Jukka Hellén;Works great! I have been using this in Finland and Sweden.;5;2019-01-24;4.75
A Google user;real rubbish cardboard. requires your entire life history and yet you can not even pay a 48h parking. their entire Marketing department should resign, maybe take care of the copier or something;1;2019-01-18;4.66
Joakim GP;Useless app. Blocks on my mobiles unable to fetch location which blocks all other functions. Cannot be recommended. ... answer to reply. that doesnt work either. too late, app dropped.;1;2019-01-11;4.66
Avinash Kumar Singh;Download ParkMan App & Use Promo Code: CAR3 - you'll get 10 € free money for your first parking!;5;2019-01-03;4.65
Tim Sundqvist;Cheaper than Easypark as well as Finnish I recommend! Take 10e parking money here with the code: PMAV;5;2018-11-27;4.534
Kim Nylund;It works and is easy to use.;5;2018-11-23;4.534
Phi Le;Easy for my life ever.;5;2018-11-16;4.533
Matias Lindroos;Amazing;5;2018-11-16;4.533
Tore Sode-Carlsen;Biggest issue is the fact that using this app mean parking is 50 percent more expensive compared to paying for parking in the conventional machine.;3;2018-10-25;4.531
A Google user;i have discount 10 e free parking but is not work when i park my car Cheating and deception is obvious;1;2018-10-23;4.11
A Google user;Works fine, use code XAQE to get free parking time.;4;2018-10-22;4.11
Badumka Duke;Price in this app is higher than in vending machines of same parking.;;;
2;2018-08-19;nan;;
A Google user;Can't create an account. Really annoying.;1;2018-08-10;4.05
Pekka Viherma;Keeps crashing and is unusable;1;2018-08-07;4.05
Peter Lindström;Crashes - can't pay for parking!;1;2018-08-07;4.03
Egidijus;Very awkward app because you pay not through a phone account but have your own bank;;;
1;2018-07-29;nan;;
Ruslanas Paulauskas;sms parking is cheaper and not complicated. In Lithuania, this program;;;
1;2018-07-23;nan;;
Sven Lanens;After installing I cannot make an account!;1;2018-07-05;4.05
Marty van Doorninck;Settings menu impossible to access... icon activates core phone functions.;1;2018-06-30;nan
Suvi-Pauliina Peräsarka;Free parking promo code EKAC;4;2018-06-24;4.04
A Google user;App itself works ok, but when it comes to service you may want have a look;;;
1;2018-06-19;4.04;;
Mattias Lundblad;Can't login to my account after I reinstalled the app on my new phone :(;1;2018-05-26;4.04
Nga Nguyen;Great tool! I have never know there is this great app to pay for my parking;5;2018-05-18;nan
Nga Nguyen;First use today work great as intended.;5;2018-05-18;nan
sushi violet;The best app to park my car in Helsinki, would never go back to easypark;5;2018-05-18;4.02
Morten Mark Juel;"Updated the app on my Hyuwei P9 today. Now the app starts, but stalls on ""fetching location"". App has access to phone gps. GoogleMaps finds my location right away. Not possible to set my location manually, app stalls and says ""google play services are updating"" ...forever... Please fix ASAP.";3;2018-05-18;4.02
Kilonzo David;Any ideas on Huawei mobile. Shuts itself after opening;3;2018-05-17;3.51
Deakn Vishous;Got a huawei and the app started recently just crashing while starting up;2;2018-05-17;3.51
jengstro notarealsurname;Crashes on Honor 9;1;2018-05-16;3.51
Juha Liikanen;Code UXFT to express parking time;5;2018-05-12;3.51
De Betong Media;The app keep shutting down for nothing;3;2018-05-11;3.51
GEORGE BARSAN;Im not to glad because i also have to pay for paking even in days that are;;;
3;2018-04-28;nan;;
Ali Asghar;It charges way more than what it says .;1;2018-04-03;3.51
Tuomas Ahola;Funding;1;2018-04-02;3.51
Farhood Hosseinpour;The information update was unsuccessful.. it is not reliable app... it failed to update my info when I urgently needed to park ...;2;2018-03-14;3.51
Gediminas Jurgutis;Scammers! Scans more from the card than the app shows. This is not a market! Shame:(;1;2018-03-06;3.50
Ais Man;Actually this is far the best parking app on the market. To get bonus of €10 of parking time, use this promo code KYPU on SignUp! So easy to use!;5;2018-02-15;3.51
A Google user;Works as intended!;5;2018-02-01;nan
A Google user;The best and easy app for parking. You can use this code ( SDKB ) and get 10€ FREE parking.;5;2018-01-04;3.50
Rasmus Schøler Sørensen;"Poor UX design. Try the following scenario: You have just installed the app and need to park for the first time. You will come to the screen where you have to enter the car's number plate. You are not standing by the car, but you have a picture of the car and number plate on your phone. So you switch to your Photo app, make a note of the license plate, and switch back to ParkMan. But instead of remembering where it was, the ParkMan app now starts all over again. The app also does not support Android multi-window function, so you can not ""pin"" the photo of your license plate while entering in the app. These are not advanced features, these are quite basic things that every Android developer encounters in the first book on Android development. Also: No developer developer address in Play store.";2;2017-12-28;3.50
Olli Mustonen;Good but costs here in Denmark 3 kr + 10% so if you can live with that it's ok.;3;2017-12-07;3.50
Algirdas Zi;Lithuanian ZIP code not accepted;2;2017-10-20;3.46
Tomas E;Absurd! Pay honestly for parking, and here instead of 0.30 € you need to pay 0.30 € + 10% + 0.1 € = 0.43 € for the same 30 minutes of parking! So why not pay from the administration part of the toll?;1;2017-10-16;3.46
Shehryar Ali;Its great and easy to use....for 10€ free parking use the code G55G;5;2017-09-30;3.46
Fred Cary;I got a ticket while using the app.  I've sent three emails to support and have yet to have one return message from them!   Update:.  I've changed the rating from one star to three after support finally reached me. While the app itself is great you are left to handle things on your own if you get a ticket while using it.  I'd rather just pay the meter than risk having to go through the hassle of a ticket.;3;2017-08-12;3.46
Andreas Warberg;I had a parking registration from 17.20 to 17.50. Was ticketed DKK 750 for observation period 17.29 to 17.39 clearly inside the valid period. The system doesn't work or parking attendants don't know how to use it.;2;2017-07-30;3.46
Sasha Mirpour;Easy to use but... parking said 11 SEK got charged 13 SEK even though I stopped it 15 min before time ended (rates including the percentage the app takes should be included from the beginning not added on later);2;2017-06-26;3.46
John Doe;Very bad implementation. Parking prices and zones are hardcoded inside the app. Unless you are absolutely certain that you have latest version, you may end up loosing your parking fee and receive a parking ticket.;1;2017-06-15;3.45
hannandor;"I did get an email regarding changing the payment plan from fixed to percentage, I did select ParkMan over other applications specially because the price was fixed. Can I still have the option to remain with the fixed price? Also I must say that the reason (improve short-term parking) that you use to advertise this price change is really lame. It's really obvious that whatever I ""save"" from short parkings I will give back much more when I do have long parkings. It's kind of obvious that this deal it's much more on your favor.";2;2017-06-11;3.45
Huntly Stuart;The costs involved in using this app have now become prohibitive;1;2017-06-01;nan
Ilir Kosova-Kakruki;It works fine;5;2017-05-31;3.45
Matti Suvanto;Functions well but the map colours are awfully difficult to read. White roads on a very light gray background equals headache.;3;2017-05-27;3.44
Orsolya Papp;Promo code BPY4 for 100kr free parking.;4;2017-05-19;3.44
Gmail Com;promo code XBB7 to get  10eur free balance. it really worked);4;2017-05-16;3.44
Chenyu Wei;You can get a free first parking for 10euros if you have a promotional code which is pretty handy. NTBU should work.;3;2017-05-14;3.44
René Steenstrup;Why can't I pay with real money, this is FUBAR...;1;2017-05-06;3.44
Marius Borze;Great parking app. Easy to use. Use promo code TSUD for one free parking max 10€;5;2017-04-18;3.43
Paul Gitau;Why would you charge me monthly standing fee even when rarely use application?;2;2017-04-05;3.20
Maunu Häkkinen;Great app. DQH4 for 10€;5;2017-04-04;3.40
Mohamed.H.M. Hassan;Use promo kode 1X82 and get 100 DKK free parking;5;2017-03-21;3.40
L P;Working;4;2017-03-21;3.40
Frank Russi;Works like charm 😊;5;2017-03-08;nan
Frederik Agner Husted;Latest promotional code GT7Z - NOK 100 free parking!;5;2017-03-06;3.33
A Google user;Free 10€ parking with code RMR2;4;2017-02-22;nan
Tapio Manninen;Better than Easypark! With this code € 10 free parking: 57J1Q;4;2017-02-14;3.27
Veera Kiminki;RQDK code for free parking.;4;2017-02-14;3.27
Mehdi Seif;Easy to use and working very fast. One of the useful app for parking.;5;2017-02-09;3.27
Freddy dsouza;A little room for improvement. Currently it is not possible to park by the hours. Min parking duration is 23hrs. This can be improved;4;2016-12-07;3.22
Kalpesh;After you download and install use code XC7W - You will get your first parking for free up to 10 €. I realised this free parking has an expiry date.;5;2016-10-26;3.22
Olga Maryasova;Promo code for free first parking: 3QRPQ.;5;2016-10-19;3.22
Petri Rauhamaa;It's handy. With the code MGRD you get 10 eur to your parking account.;4;2016-10-17;3.22
Jarrad;V6MX code to get 10€ free parking, don't forget to order a sticker for your car;5;2016-10-09;3.22
Evren;It is simply too expensive to pay 50cents more per parking. I already park for short amounts and it doubles the amount I pay.;1;2016-09-30;nan
Chris Hjuler;PR3V;5;2016-09-20;3.22
Kalle Alanen;Useless;1;2016-09-03;nan
Faroq Salama;Very good thanks a lot;4;2016-09-02;3.22
Bie JH;Super easy user-friendly Parking app which works much better than eg Europark ... Works really well especially in Copenhagen / Frb. No problems with registration (even used Gmail and Visa Dankort) Good feature with free parking works .. Finally an app that does not suck all info out of one's mobile. Seems m new the payment on system and you save money ...;5;2016-09-01;3.22
